New Hampshire,37032,25825,76179,9133,12.3,n/a,968,675,2.6,11.4,51570,70.8,4674,23647,13044,10603,18708,9524,9184,17.6,11.11,14.05,17.09,16.02,13.31,5601,0,0,0,0,46.3,611,1400,0,375,1178,0,11.6,33.3,10.5,24.2,51,51,51,51,51,51,51,51,51,51,51,51,51,51,51,51,51,51,51,51,51,51,51,51,51,51,51,51,51,51,51,51,51,51,51,51,51,51,51,51,51,51,Workforce,Average hourly wage of HS preschool assistant teacher,12.99,Average hourly wage of Head Start (HS) assistant teachers serving preschool-age children. Includes educators working in HS preschool and American Indian and Alaska Native Head Start (AIAN HS) preschool programs.,"Office of Head Start, ""Summary Report,"" available at https://hses.ohs.acf.hhs.gov/auth/login (last accessed October 2024). Average hourly wage of HS preschool assistant teachers is based on the subset of assistant teachers working in HS preschool and AIAN HS preschool programs.",Workforce,Average hourly wage of HS preschool assistant teacher,Average hourly wage of Head Start (HS) assistant teachers serving preschool-age children. Includes educators working in HS preschool and American Indian and Alaska Native Head Start (AIAN HS) preschool programs.,"Office of Head Start, ""Summary Report,"" available at https://hses.ohs.acf.hhs.gov/auth/login (last accessed October 2024). Average hourly wage of HS preschool assistant teachers is based on the subset of assistant teachers working in HS preschool and AIAN HS preschool programs.",400000,33,New Hampshire,NH,37032,25825,76179,9133,12.3,n/a,968,675,2.6,11.4,51570,70.8,4674,23647,13044,10603,18708,9524,9184,17.6,11.11,14.05,17.09,16.02,13.31,5601,0,0,0,0,46.3,611,1400,0,375,1178,0,11.6,33.3,10.5,24.2
New Jersey,303157,213684,618130,93795,15.4,n/a,3638,2564,1.2,9.4,409596,68.4,67125,25140,12480,12660,n/a,n/a,n/a,15.1,11.77,16.07,29.58,13.18,15.8,37973,20951,20,29733,28,46.2,3628,12970,82,2960,12069,85,7.9,33.9,7.1,25.4,51,51,51,51,51,51,51,51,51,51,51,51,51,51,51,51,51,51,51,51,51,51,51,51,51,51,51,51,51,51,51,51,51,51,51,51,51,51,51,51,51,51,Workforce,Average employment number in child care services,967867,Average number of child care workers during the second quarter of the year (April–June).,"Center for American Progress analysis based on U.S. Bureau of Labor Statistics Current Employment Statistics Survey, ""All employees, thousands, child care services, seasonally adjusted,"" available at https://beta.bls.gov/dataViewer/view/timeseries/CES6562440001 (last accessed October 2024). National-level employment estimates were averaged across April, May, and June to most closely match the time period during which state-level employment numbers were measured. ",Workforce,Average employment number in child care services,Average number of child care workers during the second quarter of the year (April–June).,"Center for American Progress analysis based on U.S. Bureau of Labor Statistics, ""Quarterly Census of Employment and Wages: NAICS 624410 Child care services,"" available at https://data.bls.gov/cew/apps/data_views/data_views.htm#tab=Tables (last accessed October 2024). To produce state-level estimates, average employment numbers were averaged across the second quarter of the year (which includes April, May, and June) for private, federal government, state government, and local government. Average estimates for each job ownership/employment source were summed to produce average employment in child care services across the second quarter. While the Current Employment Statistics Survey is more widely used for child care employment estimates, it is only available at the national level. The authors chose to report Current Employment Statistics national estimates and Quarterly Census of Employment and Wages state-by-state estimates.",400000,34,New Jersey,NJ,303157,213684,618130,93795,15.4,n/a,3638,2564,1.2,9.4,409596,68.4,67125,25140,12480,12660,n/a,n/a,n/a,15.1,11.77,16.07,29.58,13.18,15.8,37973,20951,20,29733,28,46.2,3628,12970,82,2960,12069,85,7.9,33.9,7.1,25.4
New Mexico,69090,49375,141074,39551,28.5,n/a,2259,1614,3.3,17.7,80600,59.8,13601,17487,9135,8352,15431,7937,7494,30,9.49,14.34,16.14,14.33,10.94,6167,891,3,8228,31,52.8,2461,7936,0,1816,7300,0,9.8,40.7,5,12.1,51,51,51,51,51,51,51,51,51,51,51,51,51,51,51,51,51,51,51,51,51,51,51,51,51,51,51,51,51,51,51,51,51,51,51,51,51,51,51,51,51,51,Head Start access,Number of infants and toddlers served by EHS,219321,"Cumulative number of infants and toddlers served by Early Head Start (EHS) and American Indian and Alaska Native Early Head Start (AIAN EHS) programs, representing the actual number of infants and toddlers served throughout an entire program year. Calculated from EHS and AIAN EHS child cumulative enrollment, all ages eligible.","Office of Head Start, ""Program Information Report, Enrollment Statistics,"" available at https://hses.ohs.acf.hhs.gov/auth/login (last accessed October 2024). Total cumulative enrollment of infants and toddlers was calculated based on EHS and AIAN EHS programs. National counts are a sum of all state-by-state numbers reported and do not include separately reported enrollment numbers for territories.",Head Start access,Number of infants and toddlers served by EHS,"Cumulative number of infants and toddlers served by Early Head Start (EHS) and American Indian and Alaska Native Early Head Start (AIAN EHS) programs, representing the actual number of infants and toddlers served throughout an entire program year. Calculated from EHS and AIAN EHS child cumulative enrollment, all ages eligible.","Office of Head Start, ""Program Information Report, Enrollment Statistics,"" available at https://hses.ohs.acf.hhs.gov/auth/login (last accessed October 2024). Total cumulative enrollment of infants and toddlers was calculated based on EHS and AIAN EHS programs. National counts are a sum of all state-by-state numbers reported and do not include separately reported enrollment numbers for territories.",400000,35,New Mexico,NM,69090,49375,141074,39551,28.5,n/a,2259,1614,3.3,17.7,80600,59.8,13601,17487,9135,8352,15431,7937,7494,30,9.49,14.34,16.14,14.33,10.94,6167,891,3,8228,31,52.8,2461,7936,0,1816,7300,0,9.8,40.7,5,12.1
New York,670496,466057,1345720,260122,19.7,n/a,45048,31312,6.7,14,870188,67.5,95491,27092,15028,12064,21112,10972,10140,16.1,12.87,18.7,20.85,15.19,13.81,76544,3721,2,117851,51,63.7,11667,48255,304,8922,45139,304,8.6,44.5,2.2,7.1,51,51,51,51,51,51,51,51,51,51,51,51,51,51,51,51,51,51,51,51,51,51,51,51,51,51,51,51,51,51,51,51,51,51,51,51,51,51,51,51,51,51,Head Start access,Number of children served by HS preschool,760643,"Cumulative number of preschool served by Head Start (HS) and American Indian and Alaska Native Head Start (AIAN HS) preschool programs, representing the actual number of preschool children served throughout an entire program year. Calculated from HS and AIAN HS child cumulative enrollment, all ages eligible.","Office of Head Start, ""Program Information Report, Enrollment Statistics,"" available at https://hses.ohs.acf.hhs.gov/auth/login (last accessed October 2024). Total cumulative enrollment of preschool children was calculated based on HS and AIAN HS programs. National counts are a sum of all state-by-state numbers reported and do not include separately reported enrollment numbers for territories.",Head Start access,Number of children served by HS preschool,"Cumulative number of preschool served by Head Start (HS) and American Indian and Alaska Native Head Start (AIAN HS) preschool programs, representing the actual number of preschool children served throughout an entire program year. Calculated from HS and AIAN HS child cumulative enrollment, all ages eligible.","Office of Head Start, ""Program Information Report, Enrollment Statistics,"" available at https://hses.ohs.acf.hhs.gov/auth/login (last accessed October 2024). Total cumulative enrollment of preschool children was calculated based on HS and AIAN HS programs. National counts are a sum of all state-by-state numbers reported and do not include separately reported enrollment numbers for territories.",400000,36,New York,NY,670496,466057,1345720,260122,19.7,n/a,45048,31312,6.7,14,870188,67.5,95491,27092,15028,12064,21112,10972,10140,16.1,12.87,18.7,20.85,15.19,13.81,76544,3721,2,117851,51,63.7,11667,48255,304,8922,45139,304,8.6,44.5,2.2,7.1
North Carolina,350121,246886,717485,151033,21.4,n/a,7473,5269,2.1,12.8,457706,67,62316,17174,9254,7920,13960,7412,6548,10.6,10.35,12.66,17.41,13.18,12.9,30707,0,0,28385,23,44.1,5898,19448,439,4625,16947,718,7.4,32.8,7.4,16.9,51,51,51,51,51,51,51,51,51,51,51,51,51,51,51,51,51,51,51,51,51,51,51,51,51,51,51,51,51,51,51,51,51,51,51,51,51,51,51,51,51,51,Head Start access,Number of children served by MSHS (all ages),24292,"Cumulative number of children of all ages served by Migrant and Seasonal Head Start (MSHS) programs, representing the actual number of children served throughout an entire program year. Calculated from MSHS child cumulative enrollment, all ages eligible.","Office of Head Start, ""Program Information Report, Enrollment Statistics,"" available at https://hses.ohs.acf.hhs.gov/auth/login (last accessed October 2024). Reflects total cumulative enrollment of children served by MSHS programs, which operate in some but not all states across the United States. National counts are a sum of all state-by-state numbers reported and do not include separately reported enrollment numbers for territories.",Head Start access,Number of children served by MSHS (all ages),"Cumulative number of children of all ages served by Migrant and Seasonal Head Start (MSHS) programs, representing the actual number of children served throughout an entire program year. Calculated from MSHS child cumulative enrollment, all ages eligible.","Office of Head Start, ""Program Information Report, Enrollment Statistics,"" available at https://hses.ohs.acf.hhs.gov/auth/login (last accessed October 2024). Reflects total cumulative enrollment of children served by MSHS programs, which operate in some but not all states across the United States. National counts are a sum of all state-by-state numbers reported and do not include separately reported enrollment numbers for territories.",400000,37,North Carolina,NC,350121,246886,717485,151033,21.4,n/a,7473,5269,2.1,12.8,457706,67,62316,17174,9254,7920,13960,7412,6548,10.6,10.35,12.66,17.41,13.18,12.9,30707,0,0,28385,23,44.1,5898,19448,439,4625,16947,718,7.4,32.8,7.4,16.9
North Dakota,30593,21582,62531,7026,11.4,n/a,714,504,2.3,15.3,45772,75.4,5300,17531,9182,8349,15067,7677,7390,10.7,11.27,11.69,20.99,14.04,12.72,3539,0,0,965,9,24.4,835,2679,0,564,2352,0,19.8,78.7,11.2,33.3,51,51,51,51,51,51,51,51,51,51,51,51,51,51,51,51,51,51,51,51,51,51,51,51,51,51,51,51,51,51,51,51,51,51,51,51,51,51,51,51,51,51,Head Start access,Funded slots for infants and toddlers in EHS,156159,Funded enrollment of infants and toddlers in Early Head Start (EHS) and American Indian and Alaska Native Early Head Start (AIAN EHS) programs.,"Office of Head Start, ""Program Information Report, Enrollment Statistics,"" available at https://hses.ohs.acf.hhs.gov/auth/login (last accessed October 2024). Total funded enrollment of infants and toddlers was calculated based on EHS and AIAN EHS programs. National counts are a sum of all state-by-state numbers reported and do not include separately reported enrollment numbers for territories.",Head Start access,Funded slots for infants and toddlers in EHS,Funded enrollment of infants and toddlers in Early Head Start (EHS) and American Indian and Alaska Native Early Head Start (AIAN EHS) programs.,"Office of Head Start, ""Program Information Report, Enrollment Statistics,"" available at https://hses.ohs.acf.hhs.gov/auth/login (last accessed October 2024). Total funded enrollment of infants and toddlers was calculated based on EHS and AIAN EHS programs. National counts are a sum of all state-by-state numbers reported and do not include separately reported enrollment numbers for territories.",400000,38,North Dakota,ND,30593,21582,62531,7026,11.4,n/a,714,504,2.3,15.3,45772,75.4,5300,17531,9182,8349,15067,7677,7390,10.7,11.27,11.69,20.99,14.04,12.72,3539,0,0,965,9,24.4,835,2679,0,564,2352,0,19.8,78.7,11.2,33.3
Ohio,405695,287083,826489,180837,22.3,n/a,9241,6539,2.3,12.6,550517,70,61811,18267,10009,8258,14038,7592,6446,11.8,10.01,12.63,17.25,13.73,12.3,34078,1737,1,16176,11,38.7,8283,34146,0,5157,29581,0,8.4,45,5.2,22.1,51,51,51,51,51,51,51,51,51,51,51,51,51,51,51,51,51,51,51,51,51,51,51,51,51,51,51,51,51,51,51,51,51,51,51,51,51,51,51,51,51,51,Head Start access,Funded slots for children in HS preschool,672084,Funded enrollment of preschoolers in Head Start (HS) and American Indian and Alaska Native Head Start (AIAN HS) programs.,"Office of Head Start, ""Program Information Report, Enrollment Statistics,"" available at https://hses.ohs.acf.hhs.gov/auth/login (last accessed October 2024). Total funded enrollment of preschool children was calculated based on enrollment in HS and AIAN HS preschool programs. National counts are a sum of all state-by-state numbers reported and do not include separately reported enrollment numbers for territories.",Head Start access,Funded slots for children in HS preschool,Funded enrollment of preschoolers in Head Start (HS) and American Indian and Alaska Native Head Start (AIAN HS) programs.,"Office of Head Start, ""Program Information Report, Enrollment Statistics,"" available at https://hses.ohs.acf.hhs.gov/auth/login (last accessed October 2024). Total funded enrollment of preschool children was calculated based on enrollment in HS and AIAN HS preschool programs. National counts are a sum of all state-by-state numbers reported and do not include separately reported enrollment numbers for territories.",400000,39,Ohio,OH,405695,287083,826489,180837,22.3,n/a,9241,6539,2.3,12.6,550517,70,61811,18267,10009,8258,14038,7592,6446,11.8,10.01,12.63,17.25,13.73,12.3,34078,1737,1,16176,11,38.7,8283,34146,0,5157,29581,0,8.4,45,5.2,22.1
Oklahoma,149175,108776,311486,74578,24.6,n/a,6448,4702,4.3,19,188772,63.9,45157,15702,8940,6762,13371,7101,6270,17.3,9.27,13.19,18.14,13.59,10.99,9680,0,0,39807,74,54.9,4728,15784,0,3311,14072,0,10.3,45.4,5.5,18.8,51,51,51,51,51,51,51,51,51,51,51,51,51,51,51,51,51,51,51,51,51,51,51,51,51,51,51,51,51,51,51,51,51,51,51,51,51,51,51,51,51,51,Head Start access,Funded slots for children in MSHS (all ages),25308,Funded enrollment of children of all ages in Migrant and Seasonal Head Start (MSHS) programs.,"Office of Head Start, ""Program Information Report, Enrollment Statistics,"" available at https://hses.ohs.acf.hhs.gov/auth/login (last accessed October 2024). Total funded enrollment of children served by MSHS programs was calculated using all eligible ages of children. MSHS programs operate in some but not all states. National counts are a sum of all state-by-state numbers reported and do not include separately reported enrollment numbers for territories.",Head Start access,Funded slots for children in MSHS (all ages),Funded enrollment of children of all ages in Migrant and Seasonal Head Start (MSHS) programs.,"Office of Head Start, ""Program Information Report, Enrollment Statistics,"" available at https://hses.ohs.acf.hhs.gov/auth/login (last accessed October 2024). Total funded enrollment of children served by MSHS programs was calculated using all eligible ages of children. MSHS programs operate in some but not all states. National counts are a sum of all state-by-state numbers reported and do not include separately reported enrollment numbers for territories.",400000,40,Oklahoma,OK,149175,108776,311486,74578,24.6,n/a,6448,4702,4.3,19,188772,63.9,45157,15702,8940,6762,13371,7101,6270,17.3,9.27,13.19,18.14,13.59,10.99,9680,0,0,39807,74,54.9,4728,15784,0,3311,14072,0,10.3,45.4,5.5,18.8
Oregon,132600,97246,274517,45303,16.9,n/a,5036,3693,3.8,9.1,174603,65.7,38520,23620,13518,10102,17491,9153,8338,11,11.86,13.95,17.71,16.42,13.05,12887,3616,8,5848,12,59.6,3168,12756,2960,2224,11215,3267,11.8,58.8,12.1,52.9,51,51,51,51,51,51,51,51,51,51,51,51,51,51,51,51,51,51,51,51,51,51,51,51,51,51,51,51,51,51,51,51,51,51,51,51,51,51,51,51,51,51,Head Start access,Percentage of infants and toddlers in poverty served by EHS,10.2,Percentage of children under age 3 in poverty who are served by Early Head Start (EHS). Uses cumulative enrollment numbers and includes both EHS and American Indian and Alaska Native EHS (AIAN EHS).,"Center for American Progress analysis based on Office of Head Start, ""Enrollment Statistics Report,"" available at https://hses.ohs.acf.hhs.gov/auth/login (last accessed October 2024); U.S. Census Bureau, ""B17006: Poverty Status in the Past 12 Months of Related Children Under 18 Years by Family Type by Age of Related Children Under 18 Years (poverty 1-year estimates for the under age 5 population),"" available at https://data.census.gov/table?q=B17006&g=010XX00US,$0400000&tid=ACSDT1Y2018.B17006&moe=false (last accessed October 2024); U.S. Census Bureau, ""B09001: Population Under 18 Years by Age (population 5-year estimates for children under age 3),"" available at https://data.census.gov/table?q=B09001:+POPULATION+UNDER+18+YEARS+BY+AGE&g=010XX00US,$0400000&tid=ACSDT1Y2018.B09001 (last accessed October 2024). National poverty estimates were calculated separately based on data from the Annual Social and Economic Supplement (ASEC) of the Current Population Survey (CPS). See Sarah Flood and others, “Integrated Public Use Microdata Series Current Population Survey: Version 12.0 (dataset)” (Minneapolis: Minnesota Population Center, 2024), available at https://cps.ipums.org/cps/. Authors divided the estimated cumulative enrollment of EHS children in poverty in each state and at the national level by the estimated number of children under age 3 in poverty in each state and at the national level. Methods are based on Allison H. Friedman-Krauss, W. Steven Barnett, and Jennifer K. Duer, ""The State(s) of Head Start and Early Head Start: Looking at Equity"" (New Brunswick, NJ: National Institute for Early Education Research, 2022), available at https://nieer.org/research-library/states-head-start-early-head-start. Cumulative enrollment of children in poverty was calculated based on children served by EHS and AIAN EHS who are eligible based on ""income below 100% of FPL,"" ""receipt of public assistance,"" or ""status as homeless.""",Head Start access,Percentage of infants and toddlers in poverty served by EHS,Percentage of children under age 3 in poverty who are served by Early Head Start (EHS). Uses cumulative enrollment numbers and includes both EHS and American Indian and Alaska Native EHS (AIAN EHS).,"Center for American Progress analysis based on Office of Head Start, ""Enrollment Statistics Report,"" available at https://hses.ohs.acf.hhs.gov/auth/login (last accessed October 2024); U.S. Census Bureau, ""B17006: Poverty Status in the Past 12 Months of Related Children Under 18 Years by Family Type by Age of Related Children Under 18 Years (poverty 1-year estimates for the under age 5 population),"" available at https://data.census.gov/table?q=B17006&g=010XX00US,$0400000&tid=ACSDT1Y2018.B17006&moe=false (last accessed October 2024); U.S. Census Bureau, ""B09001: Population Under 18 Years by Age (population 5-year estimates for children under age 3),"" available at https://data.census.gov/table?q=B09001:+POPULATION+UNDER+18+YEARS+BY+AGE&g=010XX00US,$0400000&tid=ACSDT1Y2018.B09001 (last accessed October 2024). National poverty estimates were calculated separately based on data from the Annual Social and Economic Supplement (ASEC) of the Current Population Survey (CPS). See Sarah Flood and others, “Integrated Public Use Microdata Series Current Population Survey: Version 12.0 (dataset)” (Minneapolis: Minnesota Population Center, 2024), available at https://cps.ipums.org/cps/. Authors divided the estimated cumulative enrollment of EHS children in poverty in each state and at the national level by the estimated number of children under age 3 in poverty in each state and at the national level. Methods are based on Allison H. Friedman-Krauss, W. Steven Barnett, and Jennifer K. Duer, ""The State(s) of Head Start and Early Head Start: Looking at Equity"" (New Brunswick, NJ: National Institute for Early Education Research, 2022), available at https://nieer.org/research-library/states-head-start-early-head-start. Cumulative enrollment of children in poverty was calculated based on children served by EHS and AIAN EHS who are eligible based on ""income below 100% of FPL,"" ""receipt of public assistance,"" or ""status as homeless.""",400000,41,Oregon,OR,132600,97246,274517,45303,16.9,n/a,5036,3693,3.8,9.1,174603,65.7,38520,23620,13518,10102,17491,9153,8338,11,11.86,13.95,17.71,16.42,13.05,12887,3616,8,5848,12,59.6,3168,12756,2960,2224,11215,3267,11.8,58.8,12.1,52.9
Pennsylvania,407979,291589,837601,145986,17.8,n/a,9040,6461,2.2,7.8,570558,70.8,75703,21100,11560,9540,16673,8920,7753,23.3,10.23,13.2,26.48,12.77,14.1,45881,9984,7,19726,14,57.2,9486,34413,363,6182,30174,381,12.4,56.8,9.7,26.3,51,51,51,51,51,51,51,51,51,51,51,51,51,51,51,51,51,51,51,51,51,51,51,51,51,51,51,51,51,51,51,51,51,51,51,51,51,51,51,51,51,51,Head Start access,"Percentage of 3- and 4-year-olds in poverty served by HS preschool
",45.6,Percentage of children ages 3 and 4 in poverty who are served by Head Start (HS) preschool. Uses cumulative enrollment numbers and includes HS and American Indian and Alaska Native Head Start (AIAN HS).,"Center for American Progress analysis based on Office of Head Start, ""Enrollment Statistics Report,"" available at https://hses.ohs.acf.hhs.gov/auth/login (last accessed October 2024); U.S. Census Bureau, ""B17006: Poverty Status in the Past 12 Months of Related Children Under 18 Years by Family Type by Age of Related Children Under 18 Years (poverty 1-year estimates for the under age 5 population),"" available at https://data.census.gov/table?q=B17006&g=010XX00US,$0400000&tid=ACSDT1Y2018.B17006&moe=false (last accessed October 2024); U.S. Census Bureau, ""B09001: Population Under 18 Years by Age (population 5-year estimates for children ages 3 and 4),"" available at https://data.census.gov/table?q=B09001:+POPULATION+UNDER+18+YEARS+BY+AGE&g=010XX00US,$0400000&tid=ACSDT1Y2018.B09001 (last accessed October 2024). National poverty estimates were calculated separately based on data from the Annual Social and Economic Supplement (ASEC) of the Current Population Survey (CPS). See Sarah Flood and others, “Integrated Public Use Microdata Series Current Population Survey: Version 12.0 (dataset)” (Minneapolis: Minnesota Population Center, 2024), available at https://cps.ipums.org/cps/. Authors divided the estimated cumulative enrollment of HS children in poverty in each state and at the national level by the estimated number of children ages 3 and 4 in poverty in each state and at the national level. Methods are based on Allison H. Friedman-Krauss, W. Steven Barnett, and Jennifer K. Duer, ""The State(s) of Head Start and Early Head Start: Looking at Equity"" (New Brunswick, NJ: National Institute for Early Education Research, 2022), available at https://nieer.org/research-library/states-head-start-early-head-start. Cumulative enrollment of children in poverty was calculated based on children served by HS and AIAN HS who are eligible based on ""income below 100% of FPL,"" ""receipt of public assistance,"" or ""status as homeless.""",Head Start access,"Percentage of 3- and 4-year-olds in poverty served by HS preschool
",Percentage of children ages 3 and 4 in poverty who are served by Head Start (HS) preschool. Uses cumulative enrollment numbers and includes HS and American Indian and Alaska Native Head Start (AIAN HS).,"Center for American Progress analysis based on Office of Head Start, ""Enrollment Statistics Report,"" available at https://hses.ohs.acf.hhs.gov/auth/login (last accessed October 2024); U.S. Census Bureau, ""B17006: Poverty Status in the Past 12 Months of Related Children Under 18 Years by Family Type by Age of Related Children Under 18 Years (poverty 1-year estimates for the under age 5 population),"" available at https://data.census.gov/table?q=B17006&g=010XX00US,$0400000&tid=ACSDT1Y2018.B17006&moe=false (last accessed October 2024); U.S. Census Bureau, ""B09001: Population Under 18 Years by Age (population 5-year estimates for children ages 3 and 4),"" available at https://data.census.gov/table?q=B09001:+POPULATION+UNDER+18+YEARS+BY+AGE&g=010XX00US,$0400000&tid=ACSDT1Y2018.B09001 (last accessed October 2024). National poverty estimates were calculated separately based on data from the Annual Social and Economic Supplement (ASEC) of the Current Population Survey (CPS). See Sarah Flood and others, “Integrated Public Use Microdata Series Current Population Survey: Version 12.0 (dataset)” (Minneapolis: Minnesota Population Center, 2024), available at https://cps.ipums.org/cps/. Authors divided the estimated cumulative enrollment of HS children in poverty in each state and at the national level by the estimated number of children ages 3 and 4 in poverty in each state and at the national level. Methods are based on Allison H. Friedman-Krauss, W. Steven Barnett, and Jennifer K. Duer, ""The State(s) of Head Start and Early Head Start: Looking at Equity"" (New Brunswick, NJ: National Institute for Early Education Research, 2022), available at https://nieer.org/research-library/states-head-start-early-head-start. Cumulative enrollment of children in poverty was calculated based on children served by HS and AIAN HS who are eligible based on ""income below 100% of FPL,"" ""receipt of public assistance,"" or ""status as homeless.""",400000,42,Pennsylvania,PA,407979,291589,837601,145986,17.8,n/a,9040,6461,2.2,7.8,570558,70.8,75703,21100,11560,9540,16673,8920,7753,23.3,10.23,13.2,26.48,12.77,14.1,45881,9984,7,19726,14,57.2,9486,34413,363,6182,30174,381,12.4,56.8,9.7,26.3
