Delaware,29875,24230,62415,11975,19.7,n/a,871,707,2.9,10.3,42659,71.9,5276,20403,11349,9054,14851,7876,6975,21.1,9.88,12.54,18,13.34,10.9,4027,259,2,586,5,24.9,651,1946,0,459,1723,0,10.4,37.6,2.4,3.4,51,51,51,51,51,51,51,51,51,51,51,51,51,51,51,51,51,51,51,51,51,51,51,51,51,51,51,51,51,51,51,51,51,51,51,51,51,51,51,51,51,51,Demographics and overview,Number of preschool-age children estimated to be experiencing homelessness,271387,"Number of children ages 3 and 4 estimated to be experiencing homelessness, as defined in the education subtitle of the McKinney-Vento Homeless Assistance Act.","Center for American Progress analysis based on the method developed by SchoolHouse Connection in partnership with Poverty Solutions at the University of Michigan. The authors calculated the percentage of first graders identified as homeless in each state and the national level and applied that percentage to the estimated number of children ages 3 and 4. Data downloaded from Department of Education, ""EdData Express Data Download Tool (dataset),"" available at https://eddataexpress.ed.gov/download/data-builder/data-download-tool?f%5B0%5D=age_grade%3AGrade%201&f%5B1%5D=school_year%3A2022-2023 (last accessed October 2024); Education Science National Center for Education Statistics, ""Enrollment in public elementary and secondary schools, by level, grade, and state or jurisdiction,"" available at https://nces.ed.gov/programs/digest/d23/tables/dt23_203.40.asp (last accessed October 2024); U.S. Census Bureau, ""B09001: Population Under 18 Years By Age,"" available at https://data.census.gov/table/ACSDT1Y2018.B09001?q=B09001:%20POPULATION%20UNDER%2018%20YEARS%20BY%20AGE&g=010XX00US$0400000&moe=false (last accessed October 2024).",Demographics and overview,Number of preschool-age children estimated to be experiencing homelessness,"Number of children ages 3 and 4 estimated to be experiencing homelessness, as defined in the education subtitle of the McKinney-Vento Homeless Assistance Act.","Center for American Progress analysis based on the method developed by SchoolHouse Connection in partnership with Poverty Solutions at the University of Michigan. The authors calculated the percentage of first graders identified as homeless in each state and the national level and applied that percentage to the estimated number of children ages 3 and 4. Data downloaded from Department of Education, ""EdData Express Data Download Tool (dataset),"" available at https://eddataexpress.ed.gov/download/data-builder/data-download-tool?f%5B0%5D=age_grade%3AGrade%201&f%5B1%5D=school_year%3A2022-2023 (last accessed October 2024); Education Science National Center for Education Statistics, ""Enrollment in public elementary and secondary schools, by level, grade, and state or jurisdiction,"" available at https://nces.ed.gov/programs/digest/d23/tables/dt23_203.40.asp (last accessed October 2024); U.S. Census Bureau, ""B09001: Population Under 18 Years By Age,"" available at https://data.census.gov/table/ACSDT1Y2018.B09001?q=B09001:%20POPULATION%20UNDER%2018%20YEARS%20BY%20AGE&g=010XX00US$0400000&moe=false (last accessed October 2024).",400000,10,Delaware,DE,29875,24230,62415,11975,19.7,n/a,871,707,2.9,10.3,42659,71.9,5276,20403,11349,9054,14851,7876,6975,21.1,9.88,12.54,18,13.34,10.9,4027,259,2,586,5,24.9,651,1946,0,459,1723,0,10.4,37.6,2.4,3.4
District of Columbia,27199,18291,52443,10602,20.4,n/a,2825,1900,10.4,11.7,38807,76.3,2845,43061,24081,18980,29380,18200,11180,5.8,14.84,18.37,40.5,18.48,16.65,3758,6063,73,7269,85,26.7,1640,5486,0,1243,5452,0,30.4,57.1,8,12.7,51,51,51,51,51,51,51,51,51,51,51,51,51,51,51,51,51,51,51,51,51,51,51,51,51,51,51,51,51,51,51,51,51,51,51,51,51,51,51,51,51,51,Demographics and overview,Percentage of first graders estimated to be experiencing homelessness,3.3,"Percentage of first grade students in public school identified to be experiencing homelessness, as defined in the education subtitle of the McKinney-Vento Homeless Assistance Act.","Center for American Progress analysis based on the method developed by SchoolHouse Connection in partnership with Poverty Solutions at the University of Michigan. The authors divided the number of first graders identified as homeless each year by the total number of first graders enrolled. Data for each year downloaded from Department of Education, ""EdData Express Data Download Tool (dataset),"" available at https://eddataexpress.ed.gov/download/data-builder/data-download-tool?f%5B0%5D=age_grade%3AGrade%201&f%5B1%5D=school_year%3A2022-2023 (last accessed October 2024); Institute of Education Science National Center for Education Statistics, ""Enrollment in public elementary and secondary schools, by level, grade, and state or jurisdiction,"" available at https://nces.ed.gov/programs/digest/d23/tables/dt23_203.40.asp (last accessed October 2024).",Demographics and overview,Percentage of first graders estimated to be experiencing homelessness,"Percentage of first grade students in public school identified to be experiencing homelessness, as defined in the education subtitle of the McKinney-Vento Homeless Assistance Act.","Center for American Progress analysis based on the method developed by SchoolHouse Connection in partnership with Poverty Solutions at the University of Michigan. The authors divided the number of first graders identified as homeless each year by the total number of first graders enrolled. Data for each year downloaded from Department of Education, ""EdData Express Data Download Tool (dataset),"" available at https://eddataexpress.ed.gov/download/data-builder/data-download-tool?f%5B0%5D=age_grade%3AGrade%201&f%5B1%5D=school_year%3A2022-2023 (last accessed October 2024); Institute of Education Science National Center for Education Statistics, ""Enrollment in public elementary and secondary schools, by level, grade, and state or jurisdiction,"" available at https://nces.ed.gov/programs/digest/d23/tables/dt23_203.40.asp (last accessed October 2024).",400000,11,District of Columbia,DC,27199,18291,52443,10602,20.4,n/a,2825,1900,10.4,11.7,38807,76.3,2845,43061,24081,18980,29380,18200,11180,5.8,14.84,18.37,40.5,18.48,16.65,3758,6063,73,7269,85,26.7,1640,5486,0,1243,5452,0,30.4,57.1,8,12.7
Florida,662308,472390,1355504,285014,21.4,n/a,27339,19500,4.1,6.9,870253,67,129295,16314,9312,7002,14624,8070,6554,18.2,10.51,11.89,22.5,12.58,13.22,57868,0,0,173645,77,37.7,10449,36115,2831,7819,31821,3209,7.4,33.8,2.1,6.2,51,51,51,51,51,51,51,51,51,51,51,51,51,51,51,51,51,51,51,51,51,51,51,51,51,51,51,51,51,51,51,51,51,51,51,51,51,51,51,51,51,51,Demographics and overview,Percentage of children under age 6 who have experienced two or more ACEs,9.8,Percentage of children under age 6 who have experienced two or more adverse childhood experiences (ACEs).,"Child and Adolescent Health Measurement Initiative, ""National Survey of Children's Health: Interactive Data Query,"" available at https://www.childhealthdata.org/browse/survey (last accessed October 2024). Authors obtained data exerpts for ""Adverse Childhood Experiences"" by using two-year combined estimates and selecting for ""All States"" and ""Age in 3 groups."" Responses were self-reported by survey respondents, in response to a question about a list of events that may have happened during the child’s life, with the option to skip any question they did not want to answer. Due to some changes in data reporting and the methods for calculating this indicator, the authors caution against directly comparing estimates across years.",Demographics and overview,Percentage of children under age 6 who have experienced two or more ACEs,Percentage of children under age 6 who have experienced two or more adverse childhood experiences (ACEs).,"Child and Adolescent Health Measurement Initiative, ""National Survey of Children's Health: Interactive Data Query,"" available at https://www.childhealthdata.org/browse/survey (last accessed October 2024). Authors obtained data exerpts for ""Adverse Childhood Experiences"" by using two-year combined estimates and selecting for ""All States"" and ""Age in 3 groups."" Responses were self-reported by survey respondents, in response to a question about a list of events that may have happened during the child’s life, with the option to skip any question they did not want to answer. Due to some changes in data reporting and the methods for calculating this indicator, the authors caution against directly comparing estimates across years.",400000,12,Florida,FL,662308,472390,1355504,285014,21.4,n/a,27339,19500,4.1,6.9,870253,67,129295,16314,9312,7002,14624,8070,6554,18.2,10.51,11.89,22.5,12.58,13.22,57868,0,0,173645,77,37.7,10449,36115,2831,7819,31821,3209,7.4,33.8,2.1,6.2
Georgia,363527,281655,768701,162624,21.5,n/a,9548,7398,2.6,13,501374,68.4,119860,15716,8729,6987,13346,7309,6037,6.6,9.45,13.82,17.07,13.36,10.83,33664,0,0,80536,61,44.1,5280,22458,376,4308,20133,375,6,33.5,3.2,9.6,51,51,51,51,51,51,51,51,51,51,51,51,51,51,51,51,51,51,51,51,51,51,51,51,51,51,51,51,51,51,51,51,51,51,51,51,51,51,51,51,51,51,Demographics and overview,Number of children under age 6 with all available parents in the workforce,15031803,Number of children under age 6 with all available parents in the workforce.,"U.S. Census Bureau, ""DP03: Selected Economic Characteristics, 1-year estimates,"" available at https://data.census.gov/table?q=DP03&g=010XX00US,$0400000&tid=ACSDP1Y2018.DP03&moe=false (last accessed October 2024).",Demographics and overview,Number of children under age 6 with all available parents in the workforce,Number of children under age 6 with all available parents in the workforce.,"U.S. Census Bureau, ""DP03: Selected Economic Characteristics, 1-year estimates,"" available at https://data.census.gov/table?q=DP03&g=010XX00US,$0400000&tid=ACSDP1Y2018.DP03&moe=false (last accessed October 2024).",400000,13,Georgia,GA,363527,281655,768701,162624,21.5,n/a,9548,7398,2.6,13,501374,68.4,119860,15716,8729,6987,13346,7309,6037,6.6,9.45,13.82,17.07,13.36,10.83,33664,0,0,80536,61,44.1,5280,22458,376,4308,20133,375,6,33.5,3.2,9.6
Hawaii,49858,36962,101804,14764,14.8,n/a,814,604,1.6,7.3,64249,66,7330,23340,14100,9240,17808,9048,8760,11,11.49,18.68,19.69,16.31,13.94,4306,0,0,373,2,68.3,874,2666,0,610,2341,0,10.4,38.9,15.3,16.7,51,51,51,51,51,51,51,51,51,51,51,51,51,51,51,51,51,51,51,51,51,51,51,51,51,51,51,51,51,51,51,51,51,51,51,51,51,51,51,51,51,51,Demographics and overview,Percentage of children under age 6 with all available parents in the workforce,66.7,Percentage of children under age 6 with all available parents in the workforce.,"U.S. Census Bureau, ""DP03: Selected Economic Characteristics, 1-year estimates,"" available at https://data.census.gov/table?q=DP03&g=010XX00US,$0400000&tid=ACSDP1Y2018.DP03&moe=false (last accessed October 2024).",Demographics and overview,Percentage of children under age 6 with all available parents in the workforce,Percentage of children under age 6 with all available parents in the workforce.,"U.S. Census Bureau, ""DP03: Selected Economic Characteristics, 1-year estimates,"" available at https://data.census.gov/table?q=DP03&g=010XX00US,$0400000&tid=ACSDP1Y2018.DP03&moe=false (last accessed October 2024).",400000,15,Hawaii,HI,49858,36962,101804,14764,14.8,n/a,814,604,1.6,7.3,64249,66,7330,23340,14100,9240,17808,9048,8760,11,11.49,18.68,19.69,16.31,13.94,4306,0,0,373,2,68.3,874,2666,0,610,2341,0,10.4,38.9,15.3,16.7
Idaho,65281,48375,138409,22113,16.2,n/a,2152,1594,3.3,10.2,73994,55.7,15422,16301,8636,7665,14422,7396,7026,14.9,9.91,11.29,17.17,12.42,11.66,3597,0,0,0,0,48.6,1047,2943,829,695,2497,825,9,30.8,8.9,15.8,51,51,51,51,51,51,51,51,51,51,51,51,51,51,51,51,51,51,51,51,51,51,51,51,51,51,51,51,51,51,51,51,51,51,51,51,51,51,51,51,51,51,Demographics and overview,Number of parents reporting job changes due to problems with child care,2057632,"Number of parents reporting job changes due to problems with child care, based on the percentage of parents with children ages 0–5 who reported quitting a job, not taking a job, or greatly changing their job because of problems with child care for a child ages 0–5.","Center for American Progress analysis based on U.S. Department of Health and Human Services, ""National Survey of Children's Health (dataset),"" available at https://www.census.gov/programs-surveys/nsch/data/datasets.html (last accessed October 2024). The authors based analysis on indicator K6Q27, which measures the percentage of parents with children ages 0–5 in each state who had to quit a job, not take a job, or greatly change their job because of problems with child care for a child ages 0–5. Starting in 2022, the processes for imputation and weighting by race and ethnicity were revised and adjustments were made retroactively to the 2016–2021 National Survey of Children's Health data files. The estimates for 2016–2021 are based on rereleased data files.",Demographics and overview,Number of parents reporting job changes due to problems with child care,"Number of parents reporting job changes due to problems with child care, based on the percentage of parents with children ages 0–5 who reported quitting a job, not taking a job, or greatly changing their job because of problems with child care for a child ages 0–5.","Center for American Progress analysis based on U.S. Department of Health and Human Services, ""National Survey of Children's Health (dataset),"" available at https://www.census.gov/programs-surveys/nsch/data/datasets.html (last accessed October 2024). The authors based analysis on indicator K6Q27, which measures the percentage of parents with children ages 0–5 in each state who had to quit a job, not take a job, or greatly change their job because of problems with child care for a child ages 0–5. Starting in 2022, the processes for imputation and weighting by race and ethnicity were revised and adjustments were made retroactively to the 2016–2021 National Survey of Children's Health data files. The estimates for 2016–2021 are based on rereleased data files.",400000,16,Idaho,ID,65281,48375,138409,22113,16.2,n/a,2152,1594,3.3,10.2,73994,55.7,15422,16301,8636,7665,14422,7396,7026,14.9,9.91,11.29,17.17,12.42,11.66,3597,0,0,0,0,48.6,1047,2943,829,695,2497,825,9,30.8,8.9,15.8
Illinois,449915,309470,902108,157431,17.7,n/a,12319,8473,2.7,7.3,619368,71,46062,24194,13762,10432,16569,8616,7953,8.7,10.76,13.99,27.96,14.66,15.99,34501,33318,22,41622,27,57.7,10901,32319,389,7944,26885,355,12.8,50.2,4.5,18.8,51,51,51,51,51,51,51,51,51,51,51,51,51,51,51,51,51,51,51,51,51,51,51,51,51,51,51,51,51,51,51,51,51,51,51,51,51,51,51,51,51,51,Cost of child care,Average annual child care tuition for an infant in center-based care,11896,"Average annual price of full-time, center-based child care for an infant, based on Child Care Aware's survey of child care resource and referral state networks.","Child Care Aware of America, ""The US and the High Price of Child Care Appendices,"" available at https://cdn2.hubspot.net/hubfs/3957809/2019%20Price%20of%20Care%20State%20Sheets/Final-TheUSandtheHighPriceofChildCare-Appendices.pdf?__hstc=122076244.6604150d6fb19564a2f5e0e33bdbff07.1658944286808.1667943573962.1668011226936.28&__hssc=122076244.6.1668011226936&__hsfp=1258631085&hsCtaTracking=b84e60b8-da54-4971-9364-7d5667e1a1b7%7C0be5fe22-5bef-4e54-908a-f95a653d2b14 (last accessed September 2023). Average annual prices for full-time, center-based child care can be found in Appendix I. National average price reflects the ""Average of Program-Weighted Averages"": See Child Care Aware of America, ""The US and the High Price of Child Care,"" available at https://cdn2.hubspot.net/hubfs/3957809/2019%20Price%20of%20Care%20State%20Sheets/Final-TheUSandtheHighPriceofChildCare-AnExaminationofaBrokenSystem.pdf?utm_referrer=https%3A%2F%2Fwww.childcareaware.org%2F (last accessed October 2024).",Cost of child care,Average annual child care tuition for an infant in center-based care,"Average annual price of full-time, center-based child care for an infant, based on Child Care Aware's survey of child care resource and referral state networks.","Child Care Aware of America, ""The US and the High Price of Child Care Appendices,"" available at https://cdn2.hubspot.net/hubfs/3957809/2019%20Price%20of%20Care%20State%20Sheets/Final-TheUSandtheHighPriceofChildCare-Appendices.pdf?__hstc=122076244.6604150d6fb19564a2f5e0e33bdbff07.1658944286808.1667943573962.1668011226936.28&__hssc=122076244.6.1668011226936&__hsfp=1258631085&hsCtaTracking=b84e60b8-da54-4971-9364-7d5667e1a1b7%7C0be5fe22-5bef-4e54-908a-f95a653d2b14 (last accessed September 2023). Average annual prices for full-time, center-based child care can be found in Appendix I. National average price reflects the ""Average of Program-Weighted Averages"": See Child Care Aware of America, ""The US and the High Price of Child Care,"" available at https://cdn2.hubspot.net/hubfs/3957809/2019%20Price%20of%20Care%20State%20Sheets/Final-TheUSandtheHighPriceofChildCare-AnExaminationofaBrokenSystem.pdf?utm_referrer=https%3A%2F%2Fwww.childcareaware.org%2F (last accessed October 2024).",400000,17,Illinois,IL,449915,309470,902108,157431,17.7,n/a,12319,8473,2.7,7.3,619368,71,46062,24194,13762,10432,16569,8616,7953,8.7,10.76,13.99,27.96,14.66,15.99,34501,33318,22,41622,27,57.7,10901,32319,389,7944,26885,355,12.8,50.2,4.5,18.8
Indiana,248238,169481,499719,94018,19.3,n/a,5088,3474,2.1,11.4,327427,68.9,31026,21680,12390,9290,13052,6922,6130,10,9.75,12.13,17.06,14.37,11.29,13490,0,0,0,0,55.5,3681,14321,0,2305,11795,0,6.7,34.3,5.9,24.9,51,51,51,51,51,51,51,51,51,51,51,51,51,51,51,51,51,51,51,51,51,51,51,51,51,51,51,51,51,51,51,51,51,51,51,51,51,51,51,51,51,51,Cost of child care,Average annual child care tuition for a 4-year-old in center-based care,9254,"Average annual price of full-time, center-based child care for a 4-year-old child, based on Child Care Aware's survey of child care resource and referral state networks.","Child Care Aware of America, ""The US and the High Price of Child Care Appendices,"" available at https://cdn2.hubspot.net/hubfs/3957809/2019%20Price%20of%20Care%20State%20Sheets/Final-TheUSandtheHighPriceofChildCare-Appendices.pdf?__hstc=122076244.6604150d6fb19564a2f5e0e33bdbff07.1658944286808.1667943573962.1668011226936.28&__hssc=122076244.6.1668011226936&__hsfp=1258631085&hsCtaTracking=b84e60b8-da54-4971-9364-7d5667e1a1b7%7C0be5fe22-5bef-4e54-908a-f95a653d2b14 (last accessed September 2023). Average annual prices for full-time, center-based child care can be found in Appendix I. National average price reflects the ""Average of Program-Weighted Averages"": See Child Care Aware of America, ""The US and the High Price of Child Care,"" available at https://cdn2.hubspot.net/hubfs/3957809/2019%20Price%20of%20Care%20State%20Sheets/Final-TheUSandtheHighPriceofChildCare-AnExaminationofaBrokenSystem.pdf?utm_referrer=https%3A%2F%2Fwww.childcareaware.org%2F (last accessed October 2024).",Cost of child care,Average annual child care tuition for a 4-year-old in center-based care,"Average annual price of full-time, center-based child care for a 4-year-old child, based on Child Care Aware's survey of child care resource and referral state networks.","Child Care Aware of America, ""The US and the High Price of Child Care Appendices,"" available at https://cdn2.hubspot.net/hubfs/3957809/2019%20Price%20of%20Care%20State%20Sheets/Final-TheUSandtheHighPriceofChildCare-Appendices.pdf?__hstc=122076244.6604150d6fb19564a2f5e0e33bdbff07.1658944286808.1667943573962.1668011226936.28&__hssc=122076244.6.1668011226936&__hsfp=1258631085&hsCtaTracking=b84e60b8-da54-4971-9364-7d5667e1a1b7%7C0be5fe22-5bef-4e54-908a-f95a653d2b14 (last accessed September 2023). Average annual prices for full-time, center-based child care can be found in Appendix I. National average price reflects the ""Average of Program-Weighted Averages"": See Child Care Aware of America, ""The US and the High Price of Child Care,"" available at https://cdn2.hubspot.net/hubfs/3957809/2019%20Price%20of%20Care%20State%20Sheets/Final-TheUSandtheHighPriceofChildCare-AnExaminationofaBrokenSystem.pdf?utm_referrer=https%3A%2F%2Fwww.childcareaware.org%2F (last accessed October 2024).",400000,18,Indiana,IN,248238,169481,499719,94018,19.3,n/a,5088,3474,2.1,11.4,327427,68.9,31026,21680,12390,9290,13052,6922,6130,10,9.75,12.13,17.06,14.37,11.29,13490,0,0,0,0,55.5,3681,14321,0,2305,11795,0,6.7,34.3,5.9,24.9
Iowa,116064,81593,237523,34687,14.8,n/a,1764,1240,1.5,7.2,177452,76.8,7406,19599,10743,8856,14081,7234,6847,15.1,9.41,11.87,17.87,13.98,12.52,12544,1293,3,25902,65,23,2197,6562,0,1532,5718,0,12.1,45.5,10,34.3,51,51,51,51,51,51,51,51,51,51,51,51,51,51,51,51,51,51,51,51,51,51,51,51,51,51,51,51,51,51,51,51,51,51,51,51,51,51,51,51,51,51,Cost of child care,Average annual child care tuition for two children in center-based care,21150,"Sum of the average annual price of full-time, center-based child care for one infant and one 4-year-old child, based on Child Care Aware's survey of child care resource and referral state networks.","Center for American Progress calculation based on Child Care Aware of America, ""The US and the High Price of Child Care Appendices,"" available at https://cdn2.hubspot.net/hubfs/3957809/2019%20Price%20of%20Care%20State%20Sheets/Final-TheUSandtheHighPriceofChildCare-Appendices.pdf?__hstc=122076244.6604150d6fb19564a2f5e0e33bdbff07.1658944286808.1667943573962.1668011226936.28&__hssc=122076244.6.1668011226936&__hsfp=1258631085&hsCtaTracking=b84e60b8-da54-4971-9364-7d5667e1a1b7%7C0be5fe22-5bef-4e54-908a-f95a653d2b14 (last accessed September 2023). Average annual prices for full-time, center-based child care can be found in Appendix I. Average annual child care tuition for two children was calculated by taking the sum of average annual child care tuition for one infant and one 4-year-old. National average price reflects the ""Average of Program-Weighted Averages"": See Child Care Aware of America, ""The US and the High Price of Child Care,"" available at https://cdn2.hubspot.net/hubfs/3957809/2019%20Price%20of%20Care%20State%20Sheets/Final-TheUSandtheHighPriceofChildCare-AnExaminationofaBrokenSystem.pdf?utm_referrer=https%3A%2F%2Fwww.childcareaware.org%2F (last accessed October 2024).",Cost of child care,Average annual child care tuition for two children in center-based care,"Sum of the average annual price of full-time, center-based child care for one infant and one 4-year-old child, based on Child Care Aware's survey of child care resource and referral state networks.","Center for American Progress calculation based on Child Care Aware of America, ""The US and the High Price of Child Care Appendices,"" available at https://cdn2.hubspot.net/hubfs/3957809/2019%20Price%20of%20Care%20State%20Sheets/Final-TheUSandtheHighPriceofChildCare-Appendices.pdf?__hstc=122076244.6604150d6fb19564a2f5e0e33bdbff07.1658944286808.1667943573962.1668011226936.28&__hssc=122076244.6.1668011226936&__hsfp=1258631085&hsCtaTracking=b84e60b8-da54-4971-9364-7d5667e1a1b7%7C0be5fe22-5bef-4e54-908a-f95a653d2b14 (last accessed September 2023). Average annual prices for full-time, center-based child care can be found in Appendix I. Average annual child care tuition for two children was calculated by taking the sum of average annual child care tuition for one infant and one 4-year-old. National average price reflects the ""Average of Program-Weighted Averages"": See Child Care Aware of America, ""The US and the High Price of Child Care,"" available at https://cdn2.hubspot.net/hubfs/3957809/2019%20Price%20of%20Care%20State%20Sheets/Final-TheUSandtheHighPriceofChildCare-AnExaminationofaBrokenSystem.pdf?utm_referrer=https%3A%2F%2Fwww.childcareaware.org%2F (last accessed October 2024).",400000,19,Iowa,IA,116064,81593,237523,34687,14.8,n/a,1764,1240,1.5,7.2,177452,76.8,7406,19599,10743,8856,14081,7234,6847,15.1,9.41,11.87,17.87,13.98,12.52,12544,1293,3,25902,65,23,2197,6562,0,1532,5718,0,12.1,45.5,10,34.3
