Kentucky,161357,111592,321525,84933,27.2,n/a,7934,5487,4.9,n/a,197414,66.0,29507,12112,6105,6007,12453,6624,5829,9.7,9.13,16.85,21.23,13.36,10.91,n/a,4950,9.0,14232,25.8,n/a,3198,16248,238,2358,14235,229,6.9,44.8,1.7,11.9,51,51,51,51,51,51,51,51,51,51,51,51,51,51,51,51,51,51,51,51,51,51,51,51,51,51,51,51,51,51,51,51,51,51,51,51,51,51,51,51,51,51,Cost of child care,Average annual child care tuition for a 4-year-old in family-based care,7852,"Average annual price of full-time, family-based child care for a 4-year-old child, based on Child Care Aware's survey of child care resource and referral state networks.","Child Care Aware of America, ""2017 Appendices: Parents and the High Cost of Child Care,"" available at https://www.childcareaware.org/wp-content/uploads/2018/01/2017_CCA_High_Cost_Appendices_FINAL_180112_small.pdf (last accessed September 2023). Average annual prices for full-time, family child care can be found in Appendix II. National average price reflects the ""Average of Program-Weighted Averages"": See Child Care Aware of America, ""Parents and the High Price of Child Care,"" available at https://www.childcareaware.org/wp-content/uploads/2017/12/2017_CCA_High_Cost_Report_FINAL.pdf (last accessed October 2024).",Cost of child care,Average annual child care tuition for a 4-year-old in family-based care,"Average annual price of full-time, family-based child care for a 4-year-old child, based on Child Care Aware's survey of child care resource and referral state networks.","Child Care Aware of America, ""2017 Appendices: Parents and the High Cost of Child Care,"" available at https://www.childcareaware.org/wp-content/uploads/2018/01/2017_CCA_High_Cost_Appendices_FINAL_180112_small.pdf (last accessed September 2023). Average annual prices for full-time, family child care can be found in Appendix II. National average price reflects the ""Average of Program-Weighted Averages"": See Child Care Aware of America, ""Parents and the High Price of Child Care,"" available at https://www.childcareaware.org/wp-content/uploads/2017/12/2017_CCA_High_Cost_Report_FINAL.pdf (last accessed October 2024).",400000,21,Kentucky,KY,161357,111592,321525,84933,27.2,n/a,7934,5487,4.9,n/a,197414,66,29507,12112,6105,6007,12453,6624,5829,9.7,9.13,16.85,21.23,13.36,10.91,n/a,4950,9,14232,25.8,n/a,3198,16248,238,2358,14235,229,6.9,44.8,1.7,11.9
Louisiana,189121,117842,365908,106606,29.7,n/a,6152,3834,3.3,n/a,238478,67.8,17120,11265,5683,5582,8190,3900,4290,10.0,8.90,18.48,17.48,12.49,10.69,n/a,0,0,19860,32.2,n/a,2828,21174,0,2436,18833,0,5.1,49.6,1.4,12.6,51,51,51,51,51,51,51,51,51,51,51,51,51,51,51,51,51,51,51,51,51,51,51,51,51,51,51,51,51,51,51,51,51,51,51,51,51,51,51,51,51,51,Cost of child care,Average annual child care tuition for two children in family-based care,16551,"Sum of the average annual price of full-time, family-based child care for one infant and one 4-year-old child, based on Child Care Aware's survey of child care resource and referral state networks.","Center for American Progress calculation based on Child Care Aware of America, ""2017 Appendices: Parents and the High Cost of Child Care,"" available at https://www.childcareaware.org/wp-content/uploads/2018/01/2017_CCA_High_Cost_Appendices_FINAL_180112_small.pdf (last accessed September 2023). Average annual prices for full-time, family child care can be found in Appendix II. Average annual child care tuition for two children was calculated by taking the sum of average annual child care tuition for one infant and one 4-year-old. National average price reflects the ""Average of Program-Weighted Averages"": See Child Care Aware of America, ""Parents and the High Price of Child Care,"" available at https://www.childcareaware.org/wp-content/uploads/2017/12/2017_CCA_High_Cost_Report_FINAL.pdf (last accessed October 2024).",Cost of child care,Average annual child care tuition for two children in family-based care,"Sum of the average annual price of full-time, family-based child care for one infant and one 4-year-old child, based on Child Care Aware's survey of child care resource and referral state networks.","Center for American Progress calculation based on Child Care Aware of America, ""2017 Appendices: Parents and the High Cost of Child Care,"" available at https://www.childcareaware.org/wp-content/uploads/2018/01/2017_CCA_High_Cost_Appendices_FINAL_180112_small.pdf (last accessed September 2023). Average annual prices for full-time, family child care can be found in Appendix II. Average annual child care tuition for two children was calculated by taking the sum of average annual child care tuition for one infant and one 4-year-old. National average price reflects the ""Average of Program-Weighted Averages"": See Child Care Aware of America, ""Parents and the High Price of Child Care,"" available at https://www.childcareaware.org/wp-content/uploads/2017/12/2017_CCA_High_Cost_Report_FINAL.pdf (last accessed October 2024).",400000,22,Louisiana,LA,189121,117842,365908,106606,29.7,n/a,6152,3834,3.3,n/a,238478,67.8,17120,11265,5683,5582,8190,3900,4290,10,8.9,18.48,17.48,12.49,10.69,n/a,0,0,19860,32.2,n/a,2828,21174,0,2436,18833,0,5.1,49.6,1.4,12.6
Maine,35605,28336,78987,15389,20.1,n/a,494,393,1.4,n/a,54919,72.1,6005,16897,8999,7898,15064,7849,7215,9.1,10.77,14.54,17.01,15.17,12.79,n/a,0,0,5177,40.2,n/a,1245,2799,0,812,2436,0,15.3,42.2,36.3,64.9,51,51,51,51,51,51,51,51,51,51,51,51,51,51,51,51,51,51,51,51,51,51,51,51,51,51,51,51,51,51,51,51,51,51,51,51,51,51,51,51,51,51,Child care access,Number of 3-year-olds enrolled in state-funded preschool,194979,Number of 3-year-old children enrolled in state-funded public preschool.,"National Institute for Early Education Research, ""Data Explorer, NIEER Data Sets: Preschool Enrollment,"" available at https://nieer.org/data-explorer (last accessed October 2024).",Child care access,Number of 3-year-olds enrolled in state-funded preschool,Number of 3-year-old children enrolled in state-funded public preschool.,"National Institute for Early Education Research, ""Data Explorer, NIEER Data Sets: Preschool Enrollment,"" available at https://nieer.org/data-explorer (last accessed October 2024).",400000,23,Maine,ME,35605,28336,78987,15389,20.1,n/a,494,393,1.4,n/a,54919,72.1,6005,16897,8999,7898,15064,7849,7215,9.1,10.77,14.54,17.01,15.17,12.79,n/a,0,0,5177,40.2,n/a,1245,2799,0,812,2436,0,15.3,42.2,36.3,64.9
Maryland,213628,149267,433900,57607,13.5,n/a,4633,3237,2.2,n/a,305897,73.3,29693,24470,14726,9744,18051,9967,8084,6.3,11.07,14.16,24.08,15.78,13.89,n/a,3733,5.0,27003,35.7,n/a,2232,9871,0,1622,8891,0,8.0,43.3,4.8,12.8,51,51,51,51,51,51,51,51,51,51,51,51,51,51,51,51,51,51,51,51,51,51,51,51,51,51,51,51,51,51,51,51,51,51,51,51,51,51,51,51,51,51,Child care access,Number of 4-year-olds enrolled in state-funded preschool,1276719,Number of 4-year-old children enrolled in state-funded public preschool.,"National Institute for Early Education Research, ""Data Explorer, NIEER Data Sets: Preschool Enrollment,"" available at https://nieer.org/data-explorer (last accessed October 2024).",Child care access,Number of 4-year-olds enrolled in state-funded preschool,Number of 4-year-old children enrolled in state-funded public preschool.,"National Institute for Early Education Research, ""Data Explorer, NIEER Data Sets: Preschool Enrollment,"" available at https://nieer.org/data-explorer (last accessed October 2024).",400000,24,Maryland,MD,213628,149267,433900,57607,13.5,n/a,4633,3237,2.2,n/a,305897,73.3,29693,24470,14726,9744,18051,9967,8084,6.3,11.07,14.16,24.08,15.78,13.89,n/a,3733,5,27003,35.7,n/a,2232,9871,0,1622,8891,0,8,43.3,4.8,12.8
Massachusetts,207087,152288,431779,65976,15.5,n/a,5938,4367,2.9,n/a,307336,73.6,61346,34381,20125,14256,24470,12636,11834,13.1,12.39,14.99,17.84,16.65,13.83,n/a,5329,7.3,5329,7.6,n/a,2797,12432,136,1823,10536,125,7.9,44.0,8.0,26.2,51,51,51,51,51,51,51,51,51,51,51,51,51,51,51,51,51,51,51,51,51,51,51,51,51,51,51,51,51,51,51,51,51,51,51,51,51,51,51,51,51,51,Child care access,Percentage of 3-year-olds served by state-funded preschool,4.9,Percentage of 3-year-old children enrolled in state-funded public preschool.,"National Institute for Early Education Research, ""Data Explorer, NIEER Data Sets: Preschool Enrollment,"" available at https://nieer.org/data-explorer (last accessed October 2024).",Child care access,Percentage of 3-year-olds served by state-funded preschool,Percentage of 3-year-old children enrolled in state-funded public preschool.,"National Institute for Early Education Research, ""Data Explorer, NIEER Data Sets: Preschool Enrollment,"" available at https://nieer.org/data-explorer (last accessed October 2024).",400000,25,Massachusetts,MA,207087,152288,431779,65976,15.5,n/a,5938,4367,2.9,n/a,307336,73.6,61346,34381,20125,14256,24470,12636,11834,13.1,12.39,14.99,17.84,16.65,13.83,n/a,5329,7.3,5329,7.6,n/a,2797,12432,136,1823,10536,125,7.9,44,8,26.2
Michigan,338449,233153,686957,158319,23.5,n/a,10170,7006,3.0,n/a,436207,65.8,48670,17561,10281,7280,13939,7179,6760,8.0,9.71,13.31,18.84,14.62,12.51,n/a,0,0,38771,33.6,n/a,7749,30594,1227,5975,27711,1255,9.3,47.9,6.7,22.3,51,51,51,51,51,51,51,51,51,51,51,51,51,51,51,51,51,51,51,51,51,51,51,51,51,51,51,51,51,51,51,51,51,51,51,51,51,51,51,51,51,51,Child care access,Percentage of 4-year-olds served by state-funded preschool,31.8,Percentage of 4-year-old children enrolled in state-funded public preschool.,"National Institute for Early Education Research, ""Data Explorer, NIEER Data Sets: Preschool Enrollment,"" available at https://nieer.org/data-explorer (last accessed October 2024).",Child care access,Percentage of 4-year-olds served by state-funded preschool,Percentage of 4-year-old children enrolled in state-funded public preschool.,"National Institute for Early Education Research, ""Data Explorer, NIEER Data Sets: Preschool Enrollment,"" available at https://nieer.org/data-explorer (last accessed October 2024).",400000,26,Michigan,MI,338449,233153,686957,158319,23.5,n/a,10170,7006,3,n/a,436207,65.8,48670,17561,10281,7280,13939,7179,6760,8,9.71,13.31,18.84,14.62,12.51,n/a,0,0,38771,33.6,n/a,7749,30594,1227,5975,27711,1255,9.3,47.9,6.7,22.3
Minnesota,205301,145291,419539,56427,13.6,n/a,4529,3205,2.2,n/a,307751,75.3,28747,27144,15340,11804,15860,8320,7540,8.3,11.06,14.60,18.96,16.74,13.82,n/a,759,1.1,858,1.1,n/a,3599,12856,827,2520,11097,848,12.2,55.4,6.9,28.2,51,51,51,51,51,51,51,51,51,51,51,51,51,51,51,51,51,51,51,51,51,51,51,51,51,51,51,51,51,51,51,51,51,51,51,51,51,51,51,51,51,51,Child care access,Percentage of population in a child care desert,n/a,Percentage of children under age 5 living in a child care desert. This value is representative of the 2018 landscape of child care supply.,"Rasheed Malik and others, “America’s Child Care Deserts in 2018” (Washington: Center for American Progress, 2018), available at https://www.americanprogress.org/article/americas-child-care-deserts-2018/. This value is representative of the 2018 landscape of child care supply and is currently the most recently available estimate.",Child care access,Percentage of population in a child care desert,Percentage of children under age 5 living in a child care desert. This value is representative of the 2018 landscape of child care supply.,"Rasheed Malik and others, “America’s Child Care Deserts in 2018” (Washington: Center for American Progress, 2018), available at https://www.americanprogress.org/article/americas-child-care-deserts-2018/. This value is representative of the 2018 landscape of child care supply and is currently the most recently available estimate.",400000,27,Minnesota,MN,205301,145291,419539,56427,13.6,n/a,4529,3205,2.2,n/a,307751,75.3,28747,27144,15340,11804,15860,8320,7540,8.3,11.06,14.6,18.96,16.74,13.82,n/a,759,1.1,858,1.1,n/a,3599,12856,827,2520,11097,848,12.2,55.4,6.9,28.2
Mississippi,115488,71254,223571,65810,29.8,n/a,2701,1666,2.3,n/a,144808,68.9,10299,9734,5178,4556,6227,3483,2744,13.5,8.86,12.97,14.13,12.63,10.21,n/a,263,0.7,1517,3.9,n/a,2467,21036,0,2311,19875,0,7.6,74.9,1.3,15.2,51,51,51,51,51,51,51,51,51,51,51,51,51,51,51,51,51,51,51,51,51,51,51,51,51,51,51,51,51,51,51,51,51,51,51,51,51,51,51,51,51,51,Child care access,Percentage of qualifying low-income children under age 6 who receive child care subsidies,12.3,Percentage of eligible children under age 6 who receive child care subsidies.,"Center for American Progress analysis based on data from the U.S. Department of Health and Human Services, ""Preliminary Data Table 1 - Average Monthly Adjusted Number of Families and Children Served,” February 26, 2024, available at https://www.acf.hhs.gov/occ/data/fy-2016-preliminary-data-table-1; U.S. Department of Health and Human Services, “Preliminary Data Table 9 - Average Monthly Percentages of Children in Care By Age Group,” February 26, 2024, available at https://www.acf.hhs.gov/occ/data/fy-2016-preliminary-data-table-9 (Note: Analysis relies on the Tables 1 and 9 for each respective year. Estimates for 2021, for example, rely on the data tables for FY 2021); Steven Ruggles and others, “Integrated Public Use Microdata Series, U.S. Census Data for Social, Economic, and Health Research, American Community Survey: 5-year estimates” (Minneapolis: Minnesota Population Center, 2024), available at https://usa.ipums.org/usa/.
",Child care access,Percentage of qualifying low-income children under age 6 who receive child care subsidies,Percentage of eligible children under age 6 who receive child care subsidies.,"Center for American Progress analysis based on data from the U.S. Department of Health and Human Services, ""Preliminary Data Table 1 - Average Monthly Adjusted Number of Families and Children Served,” February 26, 2024, available at https://www.acf.hhs.gov/occ/data/fy-2016-preliminary-data-table-1; U.S. Department of Health and Human Services, “Preliminary Data Table 9 - Average Monthly Percentages of Children in Care By Age Group,” February 26, 2024, available at https://www.acf.hhs.gov/occ/data/fy-2016-preliminary-data-table-9 (Note: Analysis relies on the Tables 1 and 9 for each respective year. Estimates for 2021, for example, rely on the data tables for FY 2021); Steven Ruggles and others, “Integrated Public Use Microdata Series, U.S. Census Data for Social, Economic, and Health Research, American Community Survey: 5-year estimates” (Minneapolis: Minnesota Population Center, 2024), available at https://usa.ipums.org/usa/.
",400000,28,Mississippi,MS,115488,71254,223571,65810,29.8,n/a,2701,1666,2.3,n/a,144808,68.9,10299,9734,5178,4556,6227,3483,2744,13.5,8.86,12.97,14.13,12.63,10.21,n/a,263,0.7,1517,3.9,n/a,2467,21036,0,2311,19875,0,7.6,74.9,1.3,15.2
Missouri,219409,152123,443099,96675,22.2,n/a,8828,6121,4.0,n/a,296788,69.9,18167,16016,9412,6604,10400,5564,4836,17.4,9.40,12.12,14.94,12.59,10.97,n/a,926,1.2,1563,2.1,n/a,4280,15300,0,2985,12887,0,8.6,39.7,4.0,16.1,51,51,51,51,51,51,51,51,51,51,51,51,51,51,51,51,51,51,51,51,51,51,51,51,51,51,51,51,51,51,51,51,51,51,51,51,51,51,51,51,51,51,Workforce,Median hourly wage of child care teachers,10.18,Median hourly wage of child care teachers.,"U.S. Bureau of Labor Statistics, ""Occupational Employment and Wage Statistics (OEWS) Tables,"" available at https://www.bls.gov/oes/tables.htm (last accessed October 2024). Median hourly wage is reported for workers under the occupation ""Childcare Workers.""",Workforce,Median hourly wage of child care teachers,Median hourly wage of child care teachers.,"U.S. Bureau of Labor Statistics, ""Occupational Employment and Wage Statistics (OEWS) Tables,"" available at https://www.bls.gov/oes/tables.htm (last accessed October 2024). Median hourly wage is reported for workers under the occupation ""Childcare Workers.""",400000,29,Missouri,MO,219409,152123,443099,96675,22.2,n/a,8828,6121,4,n/a,296788,69.9,18167,16016,9412,6604,10400,5564,4836,17.4,9.4,12.12,14.94,12.59,10.97,n/a,926,1.2,1563,2.1,n/a,4280,15300,0,2985,12887,0,8.6,39.7,4,16.1
Montana,33445,27698,74260,11677,16.1,n/a,827,685,2.5,n/a,47057,66.5,5547,17090,9096,7994,14328,7440,6888,11.8,9.30,13.06,14.88,11.46,11.02,n/a,0,0,0,0,n/a,1141,4494,0,821,4097,0,17.4,89.8,n/a,n/a,51,51,51,51,51,51,51,51,51,51,51,51,51,51,51,51,51,51,51,51,51,51,51,51,51,51,51,51,51,51,51,51,51,51,51,51,51,51,51,51,51,51,Workforce,Median hourly wage of preschool teachers,13.84,"Median hourly wage of preschool teachers, excluding special education teachers.","U.S. Bureau of Labor Statistics, ""Occupational Employment and Wage Statistics (OEWS) Tables,"" available at https://www.bls.gov/oes/tables.htm (last accessed October 2024). Median hourly wage is reported for workers under the occupation ""Preschool Teachers, Except Special Education.""",Workforce,Median hourly wage of preschool teachers,"Median hourly wage of preschool teachers, excluding special education teachers.","U.S. Bureau of Labor Statistics, ""Occupational Employment and Wage Statistics (OEWS) Tables,"" available at https://www.bls.gov/oes/tables.htm (last accessed October 2024). Median hourly wage is reported for workers under the occupation ""Preschool Teachers, Except Special Education.""",400000,30,Montana,MT,33445,27698,74260,11677,16.1,n/a,827,685,2.5,n/a,47057,66.5,5547,17090,9096,7994,14328,7440,6888,11.8,9.3,13.06,14.88,11.46,11.02,n/a,0,0,0,0,n/a,1141,4494,0,821,4097,0,17.4,89.8,n/a,n/a
Nebraska,79553,52604,158257,25074,16.1,n/a,978,647,1.2,n/a,114416,74.9,3749,17192,9157,8035,13828,7194,6634,12.3,9.89,19.47,22.49,15.12,11.23,n/a,3670,14.1,8227,31.6,n/a,1935,4403,40,1448,4103,54,13.8,40.8,17.2,51.8,51,51,51,51,51,51,51,51,51,51,51,51,51,51,51,51,51,51,51,51,51,51,51,51,51,51,51,51,51,51,51,51,51,51,51,51,51,51,51,51,51,51,Workforce,Average hourly wage of HS preschool classroom teacher,19.65,Average hourly wage of Head Start (HS) classroom teachers serving preschool-age children. Includes educators working in HS preschool and American Indian and Alaska Native Head Start (AIAN HS) preschool programs.,"Office of Head Start, ""Summary Report,"" available at https://hses.ohs.acf.hhs.gov/auth/login (last accessed October 2024). Average hourly wage of HS preschool classroom teachers is based on the subset of classroom teachers working in HS preschool and AIAN HS preschool programs.",Workforce,Average hourly wage of HS preschool classroom teacher,Average hourly wage of Head Start (HS) classroom teachers serving preschool-age children. Includes educators working in HS preschool and American Indian and Alaska Native Head Start (AIAN HS) preschool programs.,"Office of Head Start, ""Summary Report,"" available at https://hses.ohs.acf.hhs.gov/auth/login (last accessed October 2024). Average hourly wage of HS preschool classroom teachers is based on the subset of classroom teachers working in HS preschool and AIAN HS preschool programs.",400000,31,Nebraska,NE,79553,52604,158257,25074,16.1,n/a,978,647,1.2,n/a,114416,74.9,3749,17192,9157,8035,13828,7194,6634,12.3,9.89,19.47,22.49,15.12,11.23,n/a,3670,14.1,8227,31.6,n/a,1935,4403,40,1448,4103,54,13.8,40.8,17.2,51.8
Nevada,105462,77899,217982,44154,20.7,n/a,5847,4319,5.5,n/a,136772,65.8,39850,19103,10317,8786,16585,8572,8013,6.0,9.94,13.46,16.64,12.37,12.47,n/a,179,0.5,1357,3.8,n/a,1064,3595,0,802,2696,0,4.9,19.6,1.8,7.5,51,51,51,51,51,51,51,51,51,51,51,51,51,51,51,51,51,51,51,51,51,51,51,51,51,51,51,51,51,51,51,51,51,51,51,51,51,51,51,51,51,51,Workforce,Average hourly wage of EHS classroom teacher,13.72,Average hourly wage of Early Head Start (EHS) classroom teachers serving infants and toddlers. Includes educators working in EHS and American Indian and Alaska Native Early Head Start (AIAN EHS) programs.,"Office of Head Start, ""Summary Report,"" available at https://hses.ohs.acf.hhs.gov/auth/login (last accessed October 2024). Average hourly wage of EHS classroom teachers is based on the subset of classroom teachers working in EHS and AIAN EHS programs.",Workforce,Average hourly wage of EHS classroom teacher,Average hourly wage of Early Head Start (EHS) classroom teachers serving infants and toddlers. Includes educators working in EHS and American Indian and Alaska Native Early Head Start (AIAN EHS) programs.,"Office of Head Start, ""Summary Report,"" available at https://hses.ohs.acf.hhs.gov/auth/login (last accessed October 2024). Average hourly wage of EHS classroom teachers is based on the subset of classroom teachers working in EHS and AIAN EHS programs.",400000,32,Nevada,NV,105462,77899,217982,44154,20.7,n/a,5847,4319,5.5,n/a,136772,65.8,39850,19103,10317,8786,16585,8572,8013,6,9.94,13.46,16.64,12.37,12.47,n/a,179,0.5,1357,3.8,n/a,1064,3595,0,802,2696,0,4.9,19.6,1.8,7.5
New Hampshire,38276,26202,78891,6832,8.8,n/a,866,593,2.3,n/a,56964,75.2,7171,22152,12220,9932,17784,9152,8632,16.7,10.51,13.26,15.56,14.36,12.47,n/a,0,0,0,0,n/a,607,1496,0,375,1301,0,16.9,51.2,10.6,24.8,51,51,51,51,51,51,51,51,51,51,51,51,51,51,51,51,51,51,51,51,51,51,51,51,51,51,51,51,51,51,51,51,51,51,51,51,51,51,51,51,51,51,Workforce,Average hourly wage of HS preschool assistant teacher,12.38,Average hourly wage of Head Start (HS) assistant teachers serving preschool-age children. Includes educators working in HS preschool and American Indian and Alaska Native Head Start (AIAN HS) preschool programs.,"Office of Head Start, ""Summary Report,"" available at https://hses.ohs.acf.hhs.gov/auth/login (last accessed October 2024). Average hourly wage of HS preschool assistant teachers is based on the subset of assistant teachers working in HS preschool and AIAN HS preschool programs.",Workforce,Average hourly wage of HS preschool assistant teacher,Average hourly wage of Head Start (HS) assistant teachers serving preschool-age children. Includes educators working in HS preschool and American Indian and Alaska Native Head Start (AIAN HS) preschool programs.,"Office of Head Start, ""Summary Report,"" available at https://hses.ohs.acf.hhs.gov/auth/login (last accessed October 2024). Average hourly wage of HS preschool assistant teachers is based on the subset of assistant teachers working in HS preschool and AIAN HS preschool programs.",400000,33,New Hampshire,NH,38276,26202,78891,6832,8.8,n/a,866,593,2.3,n/a,56964,75.2,7171,22152,12220,9932,17784,9152,8632,16.7,10.51,13.26,15.56,14.36,12.47,n/a,0,0,0,0,n/a,607,1496,0,375,1301,0,16.9,51.2,10.6,24.8
New Jersey,303924,216246,631190,100377,16.1,n/a,3011,2142,1.0,n/a,414341,67.4,67504,22709,12370,10339,17788,9311,8477,14.0,10.98,16.51,28.77,13.19,16.24,n/a,20970,19.6,31800,29.1,n/a,3031,14028,93,2596,13136,85,6.5,34.8,6.2,24.0,51,51,51,51,51,51,51,51,51,51,51,51,51,51,51,51,51,51,51,51,51,51,51,51,51,51,51,51,51,51,51,51,51,51,51,51,51,51,51,51,51,51,Workforce,Average employment number in child care services,908400,Average number of child care workers during the second quarter of the year (April–June).,"Center for American Progress analysis based on U.S. Bureau of Labor Statistics Current Employment Statistics Survey, ""All employees, thousands, child care services, seasonally adjusted,"" available at https://beta.bls.gov/dataViewer/view/timeseries/CES6562440001 (last accessed October 2024). National-level employment estimates were averaged across April, May, and June to most closely match the time period during which state-level employment numbers were measured. ",Workforce,Average employment number in child care services,Average number of child care workers during the second quarter of the year (April–June).,"Center for American Progress analysis based on U.S. Bureau of Labor Statistics, ""Quarterly Census of Employment and Wages: NAICS 624410 Child care services,"" available at https://data.bls.gov/cew/apps/data_views/data_views.htm#tab=Tables (last accessed October 2024). To produce state-level estimates, average employment numbers were averaged across the second quarter of the year (which includes April, May, and June) for private, federal government, state government, and local government. Average estimates for each job ownership/employment source were summed to produce average employment in child care services across the second quarter. While the Current Employment Statistics Survey is more widely used for child care employment estimates, it is only available at the national level. The authors chose to report Current Employment Statistics national estimates and Quarterly Census of Employment and Wages state-by-state estimates.",400000,34,New Jersey,NJ,303924,216246,631190,100377,16.1,n/a,3011,2142,1,n/a,414341,67.4,67504,22709,12370,10339,17788,9311,8477,14,10.98,16.51,28.77,13.19,16.24,n/a,20970,19.6,31800,29.1,n/a,3031,14028,93,2596,13136,85,6.5,34.8,6.2,24
