New Mexico,74893,50233,151804,53309,35.7,n/a,2652,1779,3.5,n/a,89764,61.6,20996,15569,7906,7663,15383,7851,7532,19.6,9.26,13.01,16.88,13.22,10.59,n/a,503,1.9,9254,33.3,n/a,2206,8272,0,1621,7659,0,7.0,32.6,7.4,14.3,51,51,51,51,51,51,51,51,51,51,51,51,51,51,51,51,51,51,51,51,51,51,51,51,51,51,51,51,51,51,51,51,51,51,51,51,51,51,51,51,51,51,Head Start access,Number of infants and toddlers served by EHS,191807,"Cumulative number of infants and toddlers served by Early Head Start (EHS) and American Indian and Alaska Native Early Head Start (AIAN EHS) programs, representing the actual number of infants and toddlers served throughout an entire program year. Calculated from EHS and AIAN EHS child cumulative enrollment, all ages eligible.","Office of Head Start, ""Program Information Report, Enrollment Statistics,"" available at https://hses.ohs.acf.hhs.gov/auth/login (last accessed October 2024). Total cumulative enrollment of infants and toddlers was calculated based on EHS and AIAN EHS programs. National counts are a sum of all state-by-state numbers reported and do not include separately reported enrollment numbers for territories.",Head Start access,Number of infants and toddlers served by EHS,"Cumulative number of infants and toddlers served by Early Head Start (EHS) and American Indian and Alaska Native Early Head Start (AIAN EHS) programs, representing the actual number of infants and toddlers served throughout an entire program year. Calculated from EHS and AIAN EHS child cumulative enrollment, all ages eligible.","Office of Head Start, ""Program Information Report, Enrollment Statistics,"" available at https://hses.ohs.acf.hhs.gov/auth/login (last accessed October 2024). Total cumulative enrollment of infants and toddlers was calculated based on EHS and AIAN EHS programs. National counts are a sum of all state-by-state numbers reported and do not include separately reported enrollment numbers for territories.",400000,35,New Mexico,NM,74893,50233,151804,53309,35.7,n/a,2652,1779,3.5,n/a,89764,61.6,20996,15569,7906,7663,15383,7851,7532,19.6,9.26,13.01,16.88,13.22,10.59,n/a,503,1.9,9254,33.3,n/a,2206,8272,0,1621,7659,0,7,32.6,7.4,14.3
New York,682326,471494,1379138,300722,22.2,n/a,44960,31068,6.6,n/a,860302,64.8,108678,27092,15028,12064,21112,10972,10140,17.5,12.84,15.48,21.09,15.27,13.01,n/a,1509,0.6,118560,49.9,n/a,10236,54048,304,8324,48778,304,7.0,44.8,2.2,8.5,51,51,51,51,51,51,51,51,51,51,51,51,51,51,51,51,51,51,51,51,51,51,51,51,51,51,51,51,51,51,51,51,51,51,51,51,51,51,51,51,51,51,Head Start access,Number of children served by HS preschool,819625,"Cumulative number of preschool served by Head Start (HS) and American Indian and Alaska Native Head Start (AIAN HS) preschool programs, representing the actual number of preschool children served throughout an entire program year. Calculated from HS and AIAN HS child cumulative enrollment, all ages eligible.","Office of Head Start, ""Program Information Report, Enrollment Statistics,"" available at https://hses.ohs.acf.hhs.gov/auth/login (last accessed October 2024). Total cumulative enrollment of preschool children was calculated based on HS and AIAN HS programs. National counts are a sum of all state-by-state numbers reported and do not include separately reported enrollment numbers for territories.",Head Start access,Number of children served by HS preschool,"Cumulative number of preschool served by Head Start (HS) and American Indian and Alaska Native Head Start (AIAN HS) preschool programs, representing the actual number of preschool children served throughout an entire program year. Calculated from HS and AIAN HS child cumulative enrollment, all ages eligible.","Office of Head Start, ""Program Information Report, Enrollment Statistics,"" available at https://hses.ohs.acf.hhs.gov/auth/login (last accessed October 2024). Total cumulative enrollment of preschool children was calculated based on HS and AIAN HS programs. National counts are a sum of all state-by-state numbers reported and do not include separately reported enrollment numbers for territories.",400000,36,New York,NY,682326,471494,1379138,300722,22.2,n/a,44960,31068,6.6,n/a,860302,64.8,108678,27092,15028,12064,21112,10972,10140,17.5,12.84,15.48,21.09,15.27,13.01,n/a,1509,0.6,118560,49.9,n/a,10236,54048,304,8324,48778,304,7,44.8,2.2,8.5
North Carolina,356498,238006,708772,169374,24.3,n/a,7135,4763,2.0,n/a,440933,64.9,58969,17174,9254,7920,13960,7412,6548,15.3,9.61,12.61,16.62,13.24,11.74,n/a,0,0,26851,21.9,n/a,5114,19628,637,4038,17244,777,5.8,30.0,6.6,18.6,51,51,51,51,51,51,51,51,51,51,51,51,51,51,51,51,51,51,51,51,51,51,51,51,51,51,51,51,51,51,51,51,51,51,51,51,51,51,51,51,51,51,Head Start access,Number of children served by MSHS (all ages),29234,"Cumulative number of children of all ages served by Migrant and Seasonal Head Start (MSHS) programs, representing the actual number of children served throughout an entire program year. Calculated from MSHS child cumulative enrollment, all ages eligible.","Office of Head Start, ""Program Information Report, Enrollment Statistics,"" available at https://hses.ohs.acf.hhs.gov/auth/login (last accessed October 2024). Reflects total cumulative enrollment of children served by MSHS programs, which operate in some but not all states across the United States. National counts are a sum of all state-by-state numbers reported and do not include separately reported enrollment numbers for territories.",Head Start access,Number of children served by MSHS (all ages),"Cumulative number of children of all ages served by Migrant and Seasonal Head Start (MSHS) programs, representing the actual number of children served throughout an entire program year. Calculated from MSHS child cumulative enrollment, all ages eligible.","Office of Head Start, ""Program Information Report, Enrollment Statistics,"" available at https://hses.ohs.acf.hhs.gov/auth/login (last accessed October 2024). Reflects total cumulative enrollment of children served by MSHS programs, which operate in some but not all states across the United States. National counts are a sum of all state-by-state numbers reported and do not include separately reported enrollment numbers for territories.",400000,37,North Carolina,NC,356498,238006,708772,169374,24.3,n/a,7135,4763,2,n/a,440933,64.9,58969,17174,9254,7920,13960,7412,6548,15.3,9.61,12.61,16.62,13.24,11.74,n/a,0,0,26851,21.9,n/a,5114,19628,637,4038,17244,777,5.8,30,6.6,18.6
North Dakota,34001,20897,65593,9176,14.2,n/a,897,551,2.6,n/a,46624,73.5,5574,16254,8539,7715,13974,7132,6842,12.0,10.04,13.79,20.53,13.19,12.37,n/a,0,0,0,0,n/a,798,3008,0,598,2692,0,16.1,73.5,10.8,45.7,51,51,51,51,51,51,51,51,51,51,51,51,51,51,51,51,51,51,51,51,51,51,51,51,51,51,51,51,51,51,51,51,51,51,51,51,51,51,51,51,51,51,Head Start access,Funded slots for infants and toddlers in EHS,142394,Funded enrollment of infants and toddlers in Early Head Start (EHS) and American Indian and Alaska Native Early Head Start (AIAN EHS) programs.,"Office of Head Start, ""Program Information Report, Enrollment Statistics,"" available at https://hses.ohs.acf.hhs.gov/auth/login (last accessed October 2024). Total funded enrollment of infants and toddlers was calculated based on EHS and AIAN EHS programs. National counts are a sum of all state-by-state numbers reported and do not include separately reported enrollment numbers for territories.",Head Start access,Funded slots for infants and toddlers in EHS,Funded enrollment of infants and toddlers in Early Head Start (EHS) and American Indian and Alaska Native Early Head Start (AIAN EHS) programs.,"Office of Head Start, ""Program Information Report, Enrollment Statistics,"" available at https://hses.ohs.acf.hhs.gov/auth/login (last accessed October 2024). Total funded enrollment of infants and toddlers was calculated based on EHS and AIAN EHS programs. National counts are a sum of all state-by-state numbers reported and do not include separately reported enrollment numbers for territories.",400000,38,North Dakota,ND,34001,20897,65593,9176,14.2,n/a,897,551,2.6,n/a,46624,73.5,5574,16254,8539,7715,13974,7132,6842,12,10.04,13.79,20.53,13.19,12.37,n/a,0,0,0,0,n/a,798,3008,0,598,2692,0,16.1,73.5,10.8,45.7
Ohio,413952,278344,825357,192571,23.8,n/a,8700,5850,2.1,n/a,548229,69.5,78060,17675,9825,7850,14089,7358,6731,10.9,9.68,11.83,16.42,13.03,11.89,n/a,3919,2.8,10846,7.8,n/a,8201,36688,0,5124,31239,0,8.1,45.8,6.0,24.3,51,51,51,51,51,51,51,51,51,51,51,51,51,51,51,51,51,51,51,51,51,51,51,51,51,51,51,51,51,51,51,51,51,51,51,51,51,51,51,51,51,51,Head Start access,Funded slots for children in HS preschool,727480,Funded enrollment of preschoolers in Head Start (HS) and American Indian and Alaska Native Head Start (AIAN HS) programs.,"Office of Head Start, ""Program Information Report, Enrollment Statistics,"" available at https://hses.ohs.acf.hhs.gov/auth/login (last accessed October 2024). Total funded enrollment of preschool children was calculated based on enrollment in HS and AIAN HS preschool programs. National counts are a sum of all state-by-state numbers reported and do not include separately reported enrollment numbers for territories.",Head Start access,Funded slots for children in HS preschool,Funded enrollment of preschoolers in Head Start (HS) and American Indian and Alaska Native Head Start (AIAN HS) programs.,"Office of Head Start, ""Program Information Report, Enrollment Statistics,"" available at https://hses.ohs.acf.hhs.gov/auth/login (last accessed October 2024). Total funded enrollment of preschool children was calculated based on enrollment in HS and AIAN HS preschool programs. National counts are a sum of all state-by-state numbers reported and do not include separately reported enrollment numbers for territories.",400000,39,Ohio,OH,413952,278344,825357,192571,23.8,n/a,8700,5850,2.1,n/a,548229,69.5,78060,17675,9825,7850,14089,7358,6731,10.9,9.68,11.83,16.42,13.03,11.89,n/a,3919,2.8,10846,7.8,n/a,8201,36688,0,5124,31239,0,8.1,45.8,6,24.3
Oklahoma,157684,106412,317580,78667,25.3,n/a,7675,5179,4.9,n/a,187814,62.5,17655,14533,8237,6296,12812,6848,5964,17.8,9.01,15.50,17.06,12.81,10.34,n/a,1648,3.1,39593,73.8,n/a,3914,16443,0,2854,14650,0,8.5,47.3,2.8,16.9,51,51,51,51,51,51,51,51,51,51,51,51,51,51,51,51,51,51,51,51,51,51,51,51,51,51,51,51,51,51,51,51,51,51,51,51,51,51,51,51,51,51,Head Start access,Funded slots for children in MSHS (all ages),32103,Funded enrollment of children of all ages in Migrant and Seasonal Head Start (MSHS) programs.,"Office of Head Start, ""Program Information Report, Enrollment Statistics,"" available at https://hses.ohs.acf.hhs.gov/auth/login (last accessed October 2024). Total funded enrollment of children served by MSHS programs was calculated using all eligible ages of children. MSHS programs operate in some but not all states. National counts are a sum of all state-by-state numbers reported and do not include separately reported enrollment numbers for territories.",Head Start access,Funded slots for children in MSHS (all ages),Funded enrollment of children of all ages in Migrant and Seasonal Head Start (MSHS) programs.,"Office of Head Start, ""Program Information Report, Enrollment Statistics,"" available at https://hses.ohs.acf.hhs.gov/auth/login (last accessed October 2024). Total funded enrollment of children served by MSHS programs was calculated using all eligible ages of children. MSHS programs operate in some but not all states. National counts are a sum of all state-by-state numbers reported and do not include separately reported enrollment numbers for territories.",400000,40,Oklahoma,OK,157684,106412,317580,78667,25.3,n/a,7675,5179,4.9,n/a,187814,62.5,17655,14533,8237,6296,12812,6848,5964,17.8,9.01,15.5,17.06,12.81,10.34,n/a,1648,3.1,39593,73.8,n/a,3914,16443,0,2854,14650,0,8.5,47.3,2.8,16.9
Oregon,137702,96838,281128,48779,17.7,n/a,5456,3837,4.0,n/a,169083,62.4,28533,21645,12249,9396,16141,8824,7317,11.2,11.07,13.48,17.98,15.77,12.75,n/a,3214,7.0,4626,9.9,n/a,2716,12960,2808,2092,11419,3251,10.7,64.0,10.5,42.4,51,51,51,51,51,51,51,51,51,51,51,51,51,51,51,51,51,51,51,51,51,51,51,51,51,51,51,51,51,51,51,51,51,51,51,51,51,51,51,51,51,51,Head Start access,Percentage of infants and toddlers in poverty served by EHS,8.1,Percentage of children under age 3 in poverty who are served by Early Head Start (EHS). Uses cumulative enrollment numbers and includes both EHS and American Indian and Alaska Native EHS (AIAN EHS).,"Center for American Progress analysis based on Office of Head Start, ""Enrollment Statistics Report,"" available at https://hses.ohs.acf.hhs.gov/auth/login (last accessed October 2024); U.S. Census Bureau, ""B17006: Poverty Status in the Past 12 Months of Related Children Under 18 Years by Family Type by Age of Related Children Under 18 Years (poverty 1-year estimates for the under age 5 population),"" available at https://data.census.gov/table?q=B17006&g=010XX00US,$0400000&tid=ACSDT1Y2016.B17006&moe=false (last accessed October 2024); U.S. Census Bureau, ""B09001: Population Under 18 Years by Age (population 5-year estimates for children under age 3),"" available at https://data.census.gov/table?q=B09001:+POPULATION+UNDER+18+YEARS+BY+AGE&g=010XX00US,$0400000&tid=ACSDT1Y2016.B09001 (last accessed October 2024). National poverty estimates were calculated separately based on data from the Annual Social and Economic Supplement (ASEC) of the Current Population Survey (CPS). See Sarah Flood and others, “Integrated Public Use Microdata Series Current Population Survey: Version 12.0 (dataset)” (Minneapolis: Minnesota Population Center, 2024), available at https://cps.ipums.org/cps/. Authors divided the estimated cumulative enrollment of EHS children in poverty in each state and at the national level by the estimated number of children under age 3 in poverty in each state and at the national level. Methods are based on Allison H. Friedman-Krauss, W. Steven Barnett, and Jennifer K. Duer, ""The State(s) of Head Start and Early Head Start: Looking at Equity"" (New Brunswick, NJ: National Institute for Early Education Research, 2022), available at https://nieer.org/research-library/states-head-start-early-head-start. Cumulative enrollment of children in poverty was calculated based on children served by EHS and AIAN EHS who are eligible based on ""income below 100% of FPL,"" ""receipt of public assistance,"" or ""status as homeless.""",Head Start access,Percentage of infants and toddlers in poverty served by EHS,Percentage of children under age 3 in poverty who are served by Early Head Start (EHS). Uses cumulative enrollment numbers and includes both EHS and American Indian and Alaska Native EHS (AIAN EHS).,"Center for American Progress analysis based on Office of Head Start, ""Enrollment Statistics Report,"" available at https://hses.ohs.acf.hhs.gov/auth/login (last accessed October 2024); U.S. Census Bureau, ""B17006: Poverty Status in the Past 12 Months of Related Children Under 18 Years by Family Type by Age of Related Children Under 18 Years (poverty 1-year estimates for the under age 5 population),"" available at https://data.census.gov/table?q=B17006&g=010XX00US,$0400000&tid=ACSDT1Y2016.B17006&moe=false (last accessed October 2024); U.S. Census Bureau, ""B09001: Population Under 18 Years by Age (population 5-year estimates for children under age 3),"" available at https://data.census.gov/table?q=B09001:+POPULATION+UNDER+18+YEARS+BY+AGE&g=010XX00US,$0400000&tid=ACSDT1Y2016.B09001 (last accessed October 2024). National poverty estimates were calculated separately based on data from the Annual Social and Economic Supplement (ASEC) of the Current Population Survey (CPS). See Sarah Flood and others, “Integrated Public Use Microdata Series Current Population Survey: Version 12.0 (dataset)” (Minneapolis: Minnesota Population Center, 2024), available at https://cps.ipums.org/cps/. Authors divided the estimated cumulative enrollment of EHS children in poverty in each state and at the national level by the estimated number of children under age 3 in poverty in each state and at the national level. Methods are based on Allison H. Friedman-Krauss, W. Steven Barnett, and Jennifer K. Duer, ""The State(s) of Head Start and Early Head Start: Looking at Equity"" (New Brunswick, NJ: National Institute for Early Education Research, 2022), available at https://nieer.org/research-library/states-head-start-early-head-start. Cumulative enrollment of children in poverty was calculated based on children served by EHS and AIAN EHS who are eligible based on ""income below 100% of FPL,"" ""receipt of public assistance,"" or ""status as homeless.""",400000,41,Oregon,OR,137702,96838,281128,48779,17.7,n/a,5456,3837,4,n/a,169083,62.4,28533,21645,12249,9396,16141,8824,7317,11.2,11.07,13.48,17.98,15.77,12.75,n/a,3214,7,4626,9.9,n/a,2716,12960,2808,2092,11419,3251,10.7,64,10.5,42.4
Pennsylvania,423445,285681,852537,167732,20.0,n/a,7523,5076,1.8,n/a,562867,68.3,78361,21363,12129,9234,15304,8066,7238,21.0,9.42,12.51,25.72,13.14,13.63,n/a,8995,6.3,16820,11.6,n/a,7740,35355,377,5603,31430,385,9.1,51.5,8.6,32.3,51,51,51,51,51,51,51,51,51,51,51,51,51,51,51,51,51,51,51,51,51,51,51,51,51,51,51,51,51,51,51,51,51,51,51,51,51,51,51,51,51,51,Head Start access,"Percentage of 3- and 4-year-olds in poverty served by HS preschool
",44.3,Percentage of children ages 3 and 4 in poverty who are served by Head Start (HS) preschool. Uses cumulative enrollment numbers and includes HS and American Indian and Alaska Native Head Start (AIAN HS).,"Center for American Progress analysis based on Office of Head Start, ""Enrollment Statistics Report,"" available at https://hses.ohs.acf.hhs.gov/auth/login (last accessed October 2024); U.S. Census Bureau, ""B17006: Poverty Status in the Past 12 Months of Related Children Under 18 Years by Family Type by Age of Related Children Under 18 Years (poverty 1-year estimates for the under age 5 population),"" available at https://data.census.gov/table?q=B17006&g=010XX00US,$0400000&tid=ACSDT1Y2016.B17006&moe=false (last accessed October 2024); U.S. Census Bureau, ""B09001: Population Under 18 Years by Age (population 5-year estimates for children ages 3 and 4),"" available at https://data.census.gov/table?q=B09001:+POPULATION+UNDER+18+YEARS+BY+AGE&g=010XX00US,$0400000&tid=ACSDT1Y2016.B09001 (last accessed October 2024). National poverty estimates were calculated separately based on data from the Annual Social and Economic Supplement (ASEC) of the Current Population Survey (CPS). See Sarah Flood and others, “Integrated Public Use Microdata Series Current Population Survey: Version 12.0 (dataset)” (Minneapolis: Minnesota Population Center, 2024), available at https://cps.ipums.org/cps/. Authors divided the estimated cumulative enrollment of HS children in poverty in each state and at the national level by the estimated number of children ages 3 and 4 in poverty in each state and at the national level. Methods are based on Allison H. Friedman-Krauss, W. Steven Barnett, and Jennifer K. Duer, ""The State(s) of Head Start and Early Head Start: Looking at Equity"" (New Brunswick, NJ: National Institute for Early Education Research, 2022), available at https://nieer.org/research-library/states-head-start-early-head-start. Cumulative enrollment of children in poverty was calculated based on children served by HS and AIAN HS who are eligible based on ""income below 100% of FPL,"" ""receipt of public assistance,"" or ""status as homeless.""",Head Start access,"Percentage of 3- and 4-year-olds in poverty served by HS preschool
",Percentage of children ages 3 and 4 in poverty who are served by Head Start (HS) preschool. Uses cumulative enrollment numbers and includes HS and American Indian and Alaska Native Head Start (AIAN HS).,"Center for American Progress analysis based on Office of Head Start, ""Enrollment Statistics Report,"" available at https://hses.ohs.acf.hhs.gov/auth/login (last accessed October 2024); U.S. Census Bureau, ""B17006: Poverty Status in the Past 12 Months of Related Children Under 18 Years by Family Type by Age of Related Children Under 18 Years (poverty 1-year estimates for the under age 5 population),"" available at https://data.census.gov/table?q=B17006&g=010XX00US,$0400000&tid=ACSDT1Y2016.B17006&moe=false (last accessed October 2024); U.S. Census Bureau, ""B09001: Population Under 18 Years by Age (population 5-year estimates for children ages 3 and 4),"" available at https://data.census.gov/table?q=B09001:+POPULATION+UNDER+18+YEARS+BY+AGE&g=010XX00US,$0400000&tid=ACSDT1Y2016.B09001 (last accessed October 2024). National poverty estimates were calculated separately based on data from the Annual Social and Economic Supplement (ASEC) of the Current Population Survey (CPS). See Sarah Flood and others, “Integrated Public Use Microdata Series Current Population Survey: Version 12.0 (dataset)” (Minneapolis: Minnesota Population Center, 2024), available at https://cps.ipums.org/cps/. Authors divided the estimated cumulative enrollment of HS children in poverty in each state and at the national level by the estimated number of children ages 3 and 4 in poverty in each state and at the national level. Methods are based on Allison H. Friedman-Krauss, W. Steven Barnett, and Jennifer K. Duer, ""The State(s) of Head Start and Early Head Start: Looking at Equity"" (New Brunswick, NJ: National Institute for Early Education Research, 2022), available at https://nieer.org/research-library/states-head-start-early-head-start. Cumulative enrollment of children in poverty was calculated based on children served by HS and AIAN HS who are eligible based on ""income below 100% of FPL,"" ""receipt of public assistance,"" or ""status as homeless.""",400000,42,Pennsylvania,PA,423445,285681,852537,167732,20,n/a,7523,5076,1.8,n/a,562867,68.3,78361,21363,12129,9234,15304,8066,7238,21,9.42,12.51,25.72,13.14,13.63,n/a,8995,6.3,16820,11.6,n/a,7740,35355,377,5603,31430,385,9.1,51.5,8.6,32.3
Rhode Island,31256,22888,65592,11765,18.1,n/a,328,240,1.1,n/a,44589,69.8,5740,23223,13044,10179,19554,10179,9375,15.7,10.34,14.82,17.90,16.11,12.54,n/a,0,0,594,5.4,n/a,983,2695,0,614,2272,0,16.3,59.1,22.0,43.7,51,51,51,51,51,51,51,51,51,51,51,51,51,51,51,51,51,51,51,51,51,51,51,51,51,51,51,51,51,51,51,51,51,51,51,51,51,51,51,51,51,51,Head Start access,Percentage of infants and toddlers experiencing homelessness served by EHS,4.2,Percentage of children under age 3 estimated to be experiencing homelessness who are served by Early Head Start (EHS) and American Indian and Alaska Native Early Head Start (AIAN EHS) programs.,"Center for American Progress analysis based on Office of Head Start, ""Family Information Report,"" available at https://hses.ohs.acf.hhs.gov/auth/login (last accessed October 2024);  U.S. Department of Education, ""EdData Express Data Download Tool (dataset),"" available at https://eddataexpress.ed.gov/download/data-builder/data-download-tool?f%5B0%5D=age_grade%3AGrade%201&f%5B1%5D=school_year%3A2022-2023 (last accessed October 2024); Education Science National Center for Education Statistics, ""Enrollment in public elementary and secondary schools, by level, grade, and state or jurisdiction,"" available at https://nces.ed.gov/programs/digest/d23/tables/dt23_203.40.asp (last accessed October 2024); and U.S. Census Bureau, ""B09001: Population Under 18 Years By Age,"" available at https://data.census.gov/table/ACSDT1Y2016.B09001?q=B09001:%20POPULATION%20UNDER%2018%20YEARS%20BY%20AGE&g=010XX00US$0400000&moe=false (last accessed October 2024).",Head Start access,Percentage of infants and toddlers experiencing homelessness served by EHS,Percentage of children under age 3 estimated to be experiencing homelessness who are served by Early Head Start (EHS) and American Indian and Alaska Native Early Head Start (AIAN EHS) programs.,"Center for American Progress analysis based on Office of Head Start, ""Family Information Report,"" available at https://hses.ohs.acf.hhs.gov/auth/login (last accessed October 2024);  U.S. Department of Education, ""EdData Express Data Download Tool (dataset),"" available at https://eddataexpress.ed.gov/download/data-builder/data-download-tool?f%5B0%5D=age_grade%3AGrade%201&f%5B1%5D=school_year%3A2022-2023 (last accessed October 2024); Education Science National Center for Education Statistics, ""Enrollment in public elementary and secondary schools, by level, grade, and state or jurisdiction,"" available at https://nces.ed.gov/programs/digest/d23/tables/dt23_203.40.asp (last accessed October 2024); and U.S. Census Bureau, ""B09001: Population Under 18 Years By Age,"" available at https://data.census.gov/table/ACSDT1Y2016.B09001?q=B09001:%20POPULATION%20UNDER%2018%20YEARS%20BY%20AGE&g=010XX00US$0400000&moe=false (last accessed October 2024).",400000,44,Rhode Island,RI,31256,22888,65592,11765,18.1,n/a,328,240,1.1,n/a,44589,69.8,5740,23223,13044,10179,19554,10179,9375,15.7,10.34,14.82,17.9,16.11,12.54,n/a,0,0,594,5.4,n/a,983,2695,0,614,2272,0,16.3,59.1,22,43.7
