State_Indicators/state,State_Indicators/number_of_infants_and_toddlers,State_Indicators/number_of_preschool_age_children,State_Indicators/number_of_children_under_age_6,State_Indicators/number_of_children_under_age_6_who_are_in_poverty_opm,State_Indicators/percentage_of_children_under_age_6_who_are_in_poverty_opm,State_Indicators/percentage_of_children_under_age_6_who_are_in_poverty_spm,State_Indicators/num_infants_toddlers_homeless,State_Indicators/num_preschool_children_homeless,State_Indicators/pct_first_graders_homeless,State_Indicators/percentage_of_children_under_age_6_who_have_experienced_two_or_more_adverse_childhood_experiences,State_Indicators/number_of_children_under_age_6_with_all_available_parents_in_the_workforce,State_Indicators/percentage_of_children_under_age_6_with_all_available_parents_in_the_workforce,State_Indicators/number_of_parents_reporting_job_changes_due_to_problems_with_child_care,State_Indicators/average_annual_child_care_tuition_for_two_children_in_center_based_care_infant_and_4_year_old,State_Indicators/average_annual_child_care_tuition_for_an_infant_in_center_based_care,State_Indicators/average_annual_child_care_tuition_for_a_4_year_old_in_center_based_care,State_Indicators/average_annual_child_care_tuition_for_two_children_in_family_based_care_infant_and_4_year_old,State_Indicators/average_annual_child_care_tuition_for_an_infant_in_family_based_care,State_Indicators/average_annual_child_care_tuition_for_a_4_year_old_in_family_based_care,State_Indicators/percentage_of_qualifying_low_income_children_under_age_6_who_receive_child_care_subsidies,State_Indicators/median_hourly_wage_of_child_care_workers,State_Indicators/median_hourly_wage_of_preschool_teachers,State_Indicators/avg_hr_wage_HS_classroom_teacher,State_Indicators/avg_hr_wage_EHS_classroom_teacher,State_Indicators/avg_hr_wage_HS_assistant_teacher,State_Indicators/average_employment_number_in_child_care_services,State_Indicators/number_of_3_year_olds_enrolled_in_public_preschool,State_Indicators/percentage_of_3_year_olds_served_by_public_preschool,State_Indicators/number_of_4_year_olds_enrolled_in_public_preschool,State_Indicators/percentage_of_4_year_olds_served_by_public_preschool,State_Indicators/percentage_of_population_in_a_child_care_desert,State_Indicators/total_cumulative_enrollment_of_infants_and_toddlers_served_by_ehs_and_aian_ehs_programs,State_Indicators/total_cumulative_enrollment_of_preschool_age_children_served_by_hs_and_aian_hs_programs,State_Indicators/total_cumulative_enrollment_of_children_served_by_mshs_programs_all_ages,State_Indicators/total_funded_enrollment_of_infants_and_toddlers_in_ehs_or_aian_ehs_programs,State_Indicators/total_funded_enrollment_of_preschool_age_children_in_hs_or_aian_hs_programs,State_Indicators/total_funded_enrollment_of_children_served_by_mshs_programs_all_ages,State_Indicators/percentage_of_infants_and_toddlers_in_poverty_served_by_ehs_and_aian_ehs_programs,State_Indicators/percentage_of_3__and_4_year_olds_in_poverty_served_by_hs_and_aian_hs_programs,State_Indicators/pct_homeless_infants_toddlers_EHS,State_Indicators/pct_homeless_preschoolers_HS,State_Indicators/state_rank,State_Indicators/number_of_infants_and_toddlers_rank,State_Indicators/number_of_preschool_age_children_rank,State_Indicators/number_of_children_under_age_6_rank,State_Indicators/number_of_children_under_age_6_who_are_in_poverty_opm_rank,State_Indicators/percentage_of_children_under_age_6_who_are_in_poverty_opm_rank,State_Indicators/percentage_of_children_under_age_6_who_are_in_poverty_spm_rank,State_Indicators/num_infants_toddlers_homeless_rank,State_Indicators/num_preschool_children_homeless_rank,State_Indicators/pct_first_graders_homeless_rank,State_Indicators/percentage_of_children_under_age_6_who_have_experienced_two_or_more_adverse_childhood_experiences_rank,State_Indicators/number_of_children_under_age_6_with_all_available_parents_in_the_workforce_rank,State_Indicators/percentage_of_children_under_age_6_with_all_available_parents_in_the_workforce_rank,State_Indicators/number_of_parents_reporting_job_changes_due_to_problems_with_child_care_rank,State_Indicators/average_annual_child_care_tuition_for_two_children_in_center_based_care_infant_and_4_year_old_rank,State_Indicators/average_annual_child_care_tuition_for_an_infant_in_center_based_care_rank,State_Indicators/average_annual_child_care_tuition_for_a_4_year_old_in_center_based_care_rank,State_Indicators/average_annual_child_care_tuition_for_two_children_in_family_based_care_infant_and_4_year_old_rank,State_Indicators/average_annual_child_care_tuition_for_an_infant_in_family_based_care_rank,State_Indicators/average_annual_child_care_tuition_for_a_4_year_old_in_family_based_care_rank,State_Indicators/percentage_of_qualifying_low_income_children_under_age_6_who_receive_child_care_subsidies_rank,State_Indicators/median_hourly_wage_of_child_care_workers_rank,State_Indicators/median_hourly_wage_of_preschool_teachers_rank,State_Indicators/avg_hr_wage_HS_classroom_teacher_rank,State_Indicators/avg_hr_wage_EHS_classroom_teacher_rank,State_Indicators/avg_hr_wage_HS_assistant_teacher_rank,State_Indicators/average_employment_number_in_child_care_services_rank,State_Indicators/number_of_3_year_olds_enrolled_in_public_preschool_rank,State_Indicators/percentage_of_3_year_olds_served_by_public_preschool_rank,State_Indicators/number_of_4_year_olds_enrolled_in_public_preschool_rank,State_Indicators/percentage_of_4_year_olds_served_by_public_preschool_rank,State_Indicators/percentage_of_population_in_a_child_care_desert_rank,State_Indicators/total_cumulative_enrollment_of_infants_and_toddlers_served_by_ehs_and_aian_ehs_programs_rank,State_Indicators/total_cumulative_enrollment_of_preschool_age_children_served_by_hs_and_aian_hs_programs_rank,State_Indicators/total_cumulative_enrollment_of_children_served_by_mshs_programs_all_ages_rank,State_Indicators/total_funded_enrollment_of_infants_and_toddlers_in_ehs_or_aian_ehs_programs_rank,State_Indicators/total_funded_enrollment_of_preschool_age_children_in_hs_or_aian_hs_programs_rank,State_Indicators/total_funded_enrollment_of_children_served_by_mshs_programs_all_ages_rank,State_Indicators/percentage_of_infants_and_toddlers_in_poverty_served_by_ehs_and_aian_ehs_programs_rank,State_Indicators/percentage_of_3__and_4_year_olds_in_poverty_served_by_hs_and_aian_hs_programs_rank,State_Indicators/pct_homeless_infants_toddlers_EHS_rank,State_Indicators/pct_homeless_preschoolers_HS_rank,basic_statistics/SOTS category,basic_statistics/Indicator,basic_statistics/Statistic,basic_statistics/Description,basic_statistics/Notes,text_description/Web category,text_description/Indicator,text_description/Description,text_description/Notes,State_Summary/GEO.id,State_Summary/GEO.id2,State_Summary/State,State_Summary/Abbrv,State_Summary/Number of infants and toddlers,State_Summary/Number of preschool-age children,State_Summary/Number of children under age 6,State_Summary/Number of children under age 6 who are in poverty (OPM),State_Summary/Percentage of children under age 6 who are in poverty (OPM),State_Summary/Percentage of children under age 6 who are in poverty (SPM),State_Summary/Number of infants and toddlers estimated to be experiencing homelessness,State_Summary/Number of preschool-age children estimated to be experiencing homelessness,State_Summary/Percentage of first graders estimated to be experiencing homelessness,State_Summary/Percentage of children under age 6 who have experienced two or more ACEs,State_Summary/Number of children under age 6 with all available parents in the workforce,State_Summary/Percentage of children under age 6 with all available parents in the workforce,State_Summary/Number of parents reporting job changes due to problems with child care,State_Summary/Average annual child care tuition for two children in center-based care,State_Summary/Average annual child care tuition for an infant in center-based care,State_Summary/Average annual child care tuition for a 4-year-old in center-based care,State_Summary/Average annual child care tuition for two children in family-based care,State_Summary/Average annual child care tuition for an infant in family-based care,State_Summary/Average annual child care tuition for a 4-year-old in family-based care,State_Summary/Qualifying low-income children under age 6 who receive child care subsidies,State_Summary/Median hourly wage of child care teachers,State_Summary/Median hourly wage of preschool teachers,State_Summary/Average hourly wage of HS preschool classroom teacher,State_Summary/Average hourly wage of EHS classroom teacher,State_Summary/Average hourly wage of HS preschool assistant teacher,State_Summary/Average employment number in child care services,State_Summary/Number of 3-year-olds enrolled in public preschool,State_Summary/Percentage of 3-year-olds served by public preschool,State_Summary/Number of 4-year-olds enrolled in public preschool,State_Summary/Percentage of 4-year-olds served by public preschool,State_Summary/Percentage of population in a child care desert,State_Summary/Number of infants and toddlers served by EHS,State_Summary/Number of children served by HS preschool,State_Summary/Number of children served by MSHS (all ages),State_Summary/Funded slots for infants and toddlers in EHS,State_Summary/Funded slots for children in HS preschool,State_Summary/Funded slots for children in MSHS (all ages),State_Summary/Percentage of infants and toddlers in poverty served by EHS,State_Summary/Percentage of 3- and 4-year-olds in poverty served by HS preschool,State_Summary/Percentage of infants and toddlers experiencing homelessness served by EHS,State_Summary/Percentage of 3- and 4-year-olds experiencing homelessness served by HS preschool
Alabama,172212,114431,349095,92552,26.8,n/a,4009,2664,2.3,n/a,218136,65.8,25371,10653,5715,4938,9870,4867,5003,15.4,8.79,11.20,15.29,11.22,10.87,n/a,0,0,11296,18.9,n/a,2650,16564,286,2061,14891,298,5.9,44.3,2.6,14.5,51,51,51,51,51,51,51,51,51,51,51,51,51,51,51,51,51,51,51,51,51,51,51,51,51,51,51,51,51,51,51,51,51,51,51,51,51,51,51,51,51,51,Demographics and overview,Number of infants and toddlers,11726413,Number of children who are under age 3.,"U.S. Census Bureau, ""B09001: Population Under 18 Years By Age,"" available at https://data.census.gov/table/ACSDT1Y2016.B09001?q=B09001:%20POPULATION%20UNDER%2018%20YEARS%20BY%20AGE&g=010XX00US$0400000&moe=false (last accessed October 2024). The authors used one-year estimates for every year except 2020 and five-year estimates for 2020 as one-year estimates were not available for that year.",Demographics and overview,Number of infants and toddlers,Number of children who are under age 3.,"U.S. Census Bureau, ""B09001: Population Under 18 Years By Age,"" available at https://data.census.gov/table/ACSDT1Y2016.B09001?q=B09001:%20POPULATION%20UNDER%2018%20YEARS%20BY%20AGE&g=010XX00US$0400000&moe=false (last accessed October 2024). The authors used one-year estimates for every year except 2020 and five-year estimates for 2020 as one-year estimates were not available for that year.",400000,1,Alabama,AL,172212,114431,349095,92552,26.8,n/a,4009,2664,2.3,n/a,218136,65.8,25371,10653,5715,4938,9870,4867,5003,15.4,8.79,11.2,15.29,11.22,10.87,n/a,0,0,11296,18.9,n/a,2650,16564,286,2061,14891,298,5.9,44.3,2.6,14.5
Alaska,32058,20410,62668,9300,15.2,n/a,824,524,2.6,n/a,39293,65.3,4206,22464,11700,10764,19746,10101,9645,12.4,12.48,15.96,21.53,18.55,16.26,n/a,0,0,319,2.8,n/a,802,2947,0,621,2639,0,10.4,61.4,5.8,55.7,51,51,51,51,51,51,51,51,51,51,51,51,51,51,51,51,51,51,51,51,51,51,51,51,51,51,51,51,51,51,51,51,51,51,51,51,51,51,51,51,51,51,Demographics and overview,Number of preschool-age children,8059920,Number of children who are ages 3 and 4.,"U.S. Census Bureau, ""B09001: Population Under 18 Years By Age,"" available at https://data.census.gov/table?q=B09001:+POPULATION+UNDER+18+YEARS+BY+AGE&g=010XX00US$0400000&tid=ACSDT1Y2016.B09001&moe=false (last accessed October 2024). The authors used one-year estimates for every year except 2020 and five-year estimates for 2020 as one-year estimates were not available for that year.",Demographics and overview,Number of preschool-age children,Number of children who are ages 3 and 4.,"U.S. Census Bureau, ""B09001: Population Under 18 Years By Age,"" available at https://data.census.gov/table?q=B09001:+POPULATION+UNDER+18+YEARS+BY+AGE&g=010XX00US$0400000&tid=ACSDT1Y2016.B09001&moe=false (last accessed October 2024). The authors used one-year estimates for every year except 2020 and five-year estimates for 2020 as one-year estimates were not available for that year.",400000,2,Alaska,AK,32058,20410,62668,9300,15.2,n/a,824,524,2.6,n/a,39293,65.3,4206,22464,11700,10764,19746,10101,9645,12.4,12.48,15.96,21.53,18.55,16.26,n/a,0,0,319,2.8,n/a,802,2947,0,621,2639,0,10.4,61.4,5.8,55.7
Arizona,250883,185293,519935,123951,24.3,n/a,5284,3902,2.1,n/a,301769,60.9,62272,18687,10412,8275,13660,7057,6603,10.3,10.27,11.92,18.34,14.90,12.31,n/a,1602,1.9,3763,4.4,n/a,4284,17226,930,2950,15493,930,6.3,33.7,7.7,15.0,51,51,51,51,51,51,51,51,51,51,51,51,51,51,51,51,51,51,51,51,51,51,51,51,51,51,51,51,51,51,51,51,51,51,51,51,51,51,51,51,51,51,Demographics and overview,Number of children under age 6,23700412,Number of children who are under age 6.,"Center for American Progress calculation based on U.S. Census Bureau, ""B09001: Population Under 18 Years By Age, 1-year estimates,"" available at https://data.census.gov/table?q=B09001:+POPULATION+UNDER+18+YEARS+BY+AGE&g=010XX00US,$0400000&tid=ACSDT1Y2016.B09001&moe=false (last accessed October 2024). The authors calculated the sum of population estimates for children under age 3, children 3 and 4 years old, and children 5 years old to obtain an estimate of the under-age-6 population.",Demographics and overview,Number of children under age 6,Number of children who are under age 6.,"Center for American Progress calculation based on U.S. Census Bureau, ""B09001: Population Under 18 Years By Age, 1-year estimates,"" available at https://data.census.gov/table?q=B09001:+POPULATION+UNDER+18+YEARS+BY+AGE&g=010XX00US,$0400000&tid=ACSDT1Y2016.B09001&moe=false (last accessed October 2024). The authors calculated the sum of population estimates for children under age 3, children 3 and 4 years old, and children 5 years old to obtain an estimate of the under-age-6 population.",400000,4,Arizona,AZ,250883,185293,519935,123951,24.3,n/a,5284,3902,2.1,n/a,301769,60.9,62272,18687,10412,8275,13660,7057,6603,10.3,10.27,11.92,18.34,14.9,12.31,n/a,1602,1.9,3763,4.4,n/a,4284,17226,930,2950,15493,930,6.3,33.7,7.7,15
Arkansas,114733,73914,225427,59434,27.0,n/a,3337,2150,2.9,n/a,136578,64.4,16789,11338,6188,5150,9959,5211,4748,8.0,9.08,13.82,16.00,11.20,10.75,n/a,7127,18.4,12314,32.0,n/a,2570,8797,326,2059,8095,360,8.0,34.9,5.0,15.3,51,51,51,51,51,51,51,51,51,51,51,51,51,51,51,51,51,51,51,51,51,51,51,51,51,51,51,51,51,51,51,51,51,51,51,51,51,51,51,51,51,51,Demographics and overview,Number of children under age 6 who are in poverty (OPM),4948828,"Number of children who are under age 6 and living in households below the federal poverty threshold, measured by the official poverty measure.","Center for American Progress calculation based on U.S. Census Bureau, ""B17006: Poverty Status in the Past 12 Months of Related Children Under 18 Years by Family Type By Age of Related Children Under 18 Years,"" available at https://data.census.gov/table?q=B17006&g=010XX00US,$0400000&tid=ACSDT1Y2016.B17006&moe=false (last accessed October 2024). The authors calculated the number of children under age 6 in poverty by summing the estimated number of children under 5 years old and children 5 years old in each household type below the poverty level.",Demographics and overview,Number of children under age 6 who are in poverty (OPM),"Number of children who are under age 6 and living in households below the federal poverty threshold, measured by the official poverty measure.","Center for American Progress calculation based on U.S. Census Bureau, ""B17006: Poverty Status in the Past 12 Months of Related Children Under 18 Years by Family Type By Age of Related Children Under 18 Years,"" available at https://data.census.gov/table?q=B17006&g=010XX00US,$0400000&tid=ACSDT1Y2016.B17006&moe=false (last accessed October 2024). The authors calculated the number of children under age 6 in poverty by summing the estimated number of children under 5 years old and children 5 years old in each household type below the poverty level.",400000,5,Arkansas,AR,114733,73914,225427,59434,27,n/a,3337,2150,2.9,n/a,136578,64.4,16789,11338,6188,5150,9959,5211,4748,8,9.08,13.82,16,11.2,10.75,n/a,7127,18.4,12314,32,n/a,2570,8797,326,2059,8095,360,8,34.9,5,15.3
California,1455543,1025255,2980664,608247,20.7,n/a,70585,49718,4.9,n/a,1756655,61.1,218452,23077,13671,9406,17322,8878,8444,8.6,12.11,15.69,21.55,17.69,15.00,n/a,42354,8.5,178821,35.0,n/a,26046,94340,7127,19284,82388,7007,8.0,37.2,2.0,4.4,51,51,51,51,51,51,51,51,51,51,51,51,51,51,51,51,51,51,51,51,51,51,51,51,51,51,51,51,51,51,51,51,51,51,51,51,51,51,51,51,51,51,Demographics and overview,Percentage of children under age 6 who are in poverty (OPM),19.6,"Percentage of children who are under age 6 and living in households below the federal poverty threshold, measured by the official poverty measure.","Center for American Progress calculation based on data from the Annual Social and Economic Supplements (ASEC) of the Current Population Survey (CPS). See Sarah Flood and others, ""Integrated Public Use Microdata Series Current Population Survey: Version 12.0 (dataset)"" (Minneapolis: Minnesota Population Center, 2024), available at https://cps.ipums.org/cps/. The decision to use the Census Bureau's American Community Survey for state-level poverty estimates and the CPS ASEC for national-level poverty estimates was based on U.S. Census Bureau, ""Which Data Source to Use for Poverty,"" June 21, 2023, available at https://www.census.gov/topics/income-poverty/poverty/guidance/data-sources.html.",Demographics and overview,Percentage of children under age 6 who are in poverty (OPM),"Percentage of children who are under age 6 and living in households below the federal poverty threshold, measured by the official poverty measure.","Center for American Progress calculation based on U.S. Census Bureau ""B17006: Poverty Status in the Past 12 Months of Related Children Under 18 Years by Family Type By Age of Related Children Under 18 Years,"" available at https://data.census.gov/table?q=B17006&g=010XX00US,$0400000&tid=ACSDT1Y2016.B17006&moe=false (last accessed October 2024). The authors calculated the percentage of children under age 6 in poverty by dividing the estimated number of children under age 6 who were below the poverty level by the sum of the estimated number of children under age 6 who were below the poverty level and the estimated number of children under age 6 who were at or above the poverty level. National-level estimates calculated separately based on data from the Annual Social and Economic Supplements (ASEC) of the Current Population Survey (CPS). See Sarah Flood and others, ""Integrated Public Use Microdata Series Current Population Survey: Version 12.0 (dataset)"" (Minneapolis: Minnesota Population Center, 2024), available at https://cps.ipums.org/cps/. The decision to use the Census Bureau's American Community Survey for state-level poverty estimates and the CPS ASEC for national-level poverty estimates was based on U.S. Census Bureau, ""Which Data Source to Use for Poverty,"" June 21, 2023, available at https://www.census.gov/topics/income-poverty/poverty/guidance/data-sources.html.",400000,6,California,CA,1455543,1025255,2980664,608247,20.7,n/a,70585,49718,4.9,n/a,1756655,61.1,218452,23077,13671,9406,17322,8878,8444,8.6,12.11,15.69,21.55,17.69,15,n/a,42354,8.5,178821,35,n/a,26046,94340,7127,19284,82388,7007,8,37.2,2,4.4
Colorado,200661,134410,401291,54603,13.8,n/a,6136,4110,3.1,n/a,244416,62.8,40196,26367,15138,11229,18476,9741,8735,12.4,12.32,13.37,20.16,13.80,12.64,n/a,5429,8.1,15704,23.1,n/a,2631,10731,472,1734,9014,605,8.8,48.8,5.6,21.4,51,51,51,51,51,51,51,51,51,51,51,51,51,51,51,51,51,51,51,51,51,51,51,51,51,51,51,51,51,51,51,51,51,51,51,51,51,51,51,51,51,51,Demographics and overview,Percentage of children under age 6 who are in poverty (SPM),16.5,"Percentage of children who are under age 6 and living in households below the federal poverty threshold, measured by the supplemental poverty measure.","Center for American Progress analysis based on data from the ASEC of the CPS. See Sarah Flood and others, “Integrated Public Use Microdata Series Current Population Survey: Version 12.0 (dataset)” (Minneapolis: Minnesota Population Center, 2024), available https://cps.ipums.org/cps/. The data for 2017 and beyond reflect an updated processing system from previous years. The supplemental poverty measure estimates for 2019 and beyond reflect an updated methodology. Due to changes in data collection, direct comparison between data years before and after 2017 or 2019 should be made with caution.",Demographics and overview,Percentage of children under age 6 who are in poverty (SPM),"Percentage of children who are under age 6 and living in households below the federal poverty threshold, measured by the supplemental poverty measure.","Center for American Progress analysis based on data from the ASEC of the CPS. See Sarah Flood and others, “Integrated Public Use Microdata Series Current Population Survey: Version 12.0 (dataset)” (Minneapolis: Minnesota Population Center, 2024), available https://cps.ipums.org/cps/. The data for 2017 and beyond reflect an updated processing system from previous years. The supplemental poverty measure estimates for 2019 and beyond reflect an updated methodology. Due to changes in data collection, direct comparison between data years before and after 2017 or 2019 should be made with caution.",400000,8,Colorado,CO,200661,134410,401291,54603,13.8,n/a,6136,4110,3.1,n/a,244416,62.8,40196,26367,15138,11229,18476,9741,8735,12.4,12.32,13.37,20.16,13.8,12.64,n/a,5429,8.1,15704,23.1,n/a,2631,10731,472,1734,9014,605,8.8,48.8,5.6,21.4
Connecticut,107401,77628,222805,32555,14.9,n/a,1097,793,1.0,n/a,158671,73.5,18320,27144,14924,12220,20436,10452,9984,10.8,11.25,15.13,22.85,16.16,13.16,n/a,3623,9.5,9222,23.7,n/a,1449,5914,0,1121,5175,0,8.3,39.6,17.2,33.7,51,51,51,51,51,51,51,51,51,51,51,51,51,51,51,51,51,51,51,51,51,51,51,51,51,51,51,51,51,51,51,51,51,51,51,51,51,51,51,51,51,51,Demographics and overview,Number of infants and toddlers estimated to be experiencing homelessness,362600,"Number of children under age 3 estimated to be experiencing homelessness, as defined in the education subtitle of the McKinney-Vento Homeless Assistance Act.","Center for American Progress analysis based on the method developed by SchoolHouse Connection in partnership with Poverty Solutions at the University of Michigan. The authors calculated the percentage of first graders identified as homeless in each state and the national level and applied that percentage to the estimated number of children under age 3. Data downloaded from U.S. Department of Education, ""EdData Express Data Download Tool (dataset),"" available at https://eddataexpress.ed.gov/download/data-builder/data-download-tool?f%5B0%5D=age_grade%3AGrade%201&f%5B1%5D=school_year%3A2022-2023 (last accessed October 2024); Education Science National Center for Education Statistics, ""Enrollment in public elementary and secondary schools, by level, grade, and state or jurisdiction,"" available at https://nces.ed.gov/programs/digest/d23/tables/dt23_203.40.asp (last accessed October 2024); U.S. Census Bureau, ""B09001: Population Under 18 Years By Age,"" available at https://data.census.gov/table/ACSDT1Y2016.B09001?q=B09001:%20POPULATION%20UNDER%2018%20YEARS%20BY%20AGE&g=010XX00US$0400000&moe=false (last accessed October 2024).",Demographics and overview,Number of infants and toddlers estimated to be experiencing homelessness,"Number of children under age 3 estimated to be experiencing homelessness, as defined in the education subtitle of the McKinney-Vento Homeless Assistance Act.","Center for American Progress analysis based on the method developed by SchoolHouse Connection in partnership with Poverty Solutions at the University of Michigan. The authors calculated the percentage of first graders identified as homeless in each state and the national level and applied that percentage to the estimated number of children under age 3. Data downloaded from U.S. Department of Education, ""EdData Express Data Download Tool (dataset),"" available at https://eddataexpress.ed.gov/download/data-builder/data-download-tool?f%5B0%5D=age_grade%3AGrade%201&f%5B1%5D=school_year%3A2022-2023 (last accessed October 2024); Education Science National Center for Education Statistics, ""Enrollment in public elementary and secondary schools, by level, grade, and state or jurisdiction,"" available at https://nces.ed.gov/programs/digest/d23/tables/dt23_203.40.asp (last accessed October 2024); U.S. Census Bureau, ""B09001: Population Under 18 Years By Age,"" available at https://data.census.gov/table/ACSDT1Y2016.B09001?q=B09001:%20POPULATION%20UNDER%2018%20YEARS%20BY%20AGE&g=010XX00US$0400000&moe=false (last accessed October 2024).",400000,9,Connecticut,CT,107401,77628,222805,32555,14.9,n/a,1097,793,1,n/a,158671,73.5,18320,27144,14924,12220,20436,10452,9984,10.8,11.25,15.13,22.85,16.16,13.16,n/a,3623,9.5,9222,23.7,n/a,1449,5914,0,1121,5175,0,8.3,39.6,17.2,33.7
